Mid Level Software Engineer  Java, Distilled SCH , https://ie.indeed.com/jobs?q=java+developer&l=Dublin&start=0&vjk=aebc309e80d4049d
Junior Software Engineers x 2, Recommender X , https://ie.indeed.com/jobs?q=java+developer&l=Dublin&start=0&vjk=ff9ef06b76461d95
Software Developer Graduate  Dublin Ireland, Guidewire Software Inc , https://ie.indeed.com/jobs?q=java+developer&l=Dublin&start=0&vjk=f591cbc8b3877015
Software Developer  Intern, Groupon , https://ie.indeed.com/jobs?q=java+developer&l=Dublin&start=0&vjk=760b43367b189551
SOFTWARE ENGINEER, SONALAKE , https://ie.indeed.com/jobs?q=java+developer&l=Dublin&start=0&vjk=646012274d154a5e
Software Engineer  Web Applications, Truata , https://ie.indeed.com/jobs?q=java+developer&l=Dublin&start=0&vjk=110a4999c0b13469
Software Engineer, BrowserStack , https://ie.indeed.com/jobs?q=java+developer&l=Dublin&start=0&vjk=c13282830e2003cc
Java Developer, Version 1 , https://ie.indeed.com/jobs?q=java+developer&l=Dublin&start=0&vjk=386ebcbb051449dc
Java Developer, Citi , https://ie.indeed.com/jobs?q=java+developer&l=Dublin&start=0&vjk=93c86aee8ba4ecc9
Student Research Collaboration, Google , https://ie.indeed.com/jobs?q=java+developer&l=Dublin&start=0&vjk=5bf6b55729fdb762
Student Research Collaboration, Google , https://ie.indeed.com/jobs?q=java+developer&l=Dublin&start=10&vjk=5bf6b55729fdb762
Java Developer, BearingPoint Ireland , https://ie.indeed.com/jobs?q=java+developer&l=Dublin&start=10&vjk=491d4af065a3417d
JavaScala Developer conversion to Robotic Process Automatio, MindweaverAI , https://ie.indeed.com/jobs?q=java+developer&l=Dublin&start=10&vjk=358b6850dbe0c120
Software Development Engineer  OMSUI, Workday , https://ie.indeed.com/jobs?q=java+developer&l=Dublin&start=10&vjk=f0927aa80c34a6a0
Backend Engineer Ireland, Arcblock Inc , https://ie.indeed.com/jobs?q=java+developer&l=Dublin&start=10&vjk=535c6d3339517394
Software Engineer, Dun  Bradstreet , https://ie.indeed.com/jobs?q=java+developer&l=Dublin&start=10&vjk=dae69d3ed32384ee
Java Developer, Murex SAS , https://ie.indeed.com/jobs?q=java+developer&l=Dublin&start=10&vjk=2daa90e0c639aa3c
Java Developer, Davy , https://ie.indeed.com/jobs?q=java+developer&l=Dublin&start=10&vjk=cef163fde8d82c1b
Java  API Developer, Version 1 , https://ie.indeed.com/jobs?q=java+developer&l=Dublin&start=10&vjk=eb5bdbaccb6db4a0
Java Developer  Support, Version 1 , https://ie.indeed.com/jobs?q=java+developer&l=Dublin&start=10&vjk=f98bae404094b80f
Developer, Intercontinental Exchange , https://ie.indeed.com/jobs?q=java+developer&l=Dublin&start=20&vjk=c910a2c462bc67fd
Java Engineer, Credit Suisse , https://ie.indeed.com/jobs?q=java+developer&l=Dublin&start=20&vjk=94d7d861e35e7f0d
Software Engineering or Site Reliability Engineering Intern, Google , https://ie.indeed.com/jobs?q=java+developer&l=Dublin&start=20&vjk=6193ada8624f82fb
Software Engineer, Susquehanna , https://ie.indeed.com/jobs?q=java+developer&l=Dublin&start=20&vjk=6142e8470368f687
Java Software Developer, Realex Payments , https://ie.indeed.com/jobs?q=java+developer&l=Dublin&start=20&vjk=f7e10699ca7826b2
Full Stack Java Developer, Franchise Direct , https://ie.indeed.com/jobs?q=java+developer&l=Dublin&start=20&vjk=e03a8bc0d02ce473
Software Engineer Back end  Dublin Ireland, Jet  The Walmart eCommerce Family of Brands , https://ie.indeed.com/jobs?q=java+developer&l=Dublin&start=20&vjk=9c95a0dd7c3e0160
Software Development Intern, FINEOS Corporation , https://ie.indeed.com/jobs?q=java+developer&l=Dublin&start=20&vjk=b7cde7d4420fcd1b
Software Engineer Developer, Fidelity Investments , https://ie.indeed.com/jobs?q=java+developer&l=Dublin&start=20&vjk=7191ea69df944885
Software Development Engineer, Workday , https://ie.indeed.com/jobs?q=java+developer&l=Dublin&start=20&vjk=e61f09e24bc7fc5f
BACKENDFRONTEND FULL STACK DEVELOPER, Cortex Cognition , https://ie.indeed.com/jobs?q=java+developer&l=Dublin&start=30&vjk=295b355763c54edd
Full Stack Backend  Frontend developer, Cortex Cognition , https://ie.indeed.com/jobs?q=java+developer&l=Dublin&start=30&vjk=6dbffad5115181dc
Fullstack Software Engineer, SoapBox Labs , https://ie.indeed.com/jobs?q=java+developer&l=Dublin&start=30&vjk=df790c252edbb014
Senior Java Developer, Version 1 , https://ie.indeed.com/jobs?q=java+developer&l=Dublin&start=30&vjk=c28647101e8daf79
Technical Customer Service, Amazoncom , https://ie.indeed.com/jobs?q=java+developer&l=Dublin&start=30&vjk=bfc4501ce7d5b95b
Java EE Developer, Ryanair , https://ie.indeed.com/jobs?q=java+developer&l=Dublin&start=30&vjk=ce3137888f98ae13
Senior Java Developer, Halian International , https://ie.indeed.com/jobs?q=java+developer&l=Dublin&start=30&vjk=e65cae41058e31fe
UIMobile Build and Release Engineer, Workday , https://ie.indeed.com/jobs?q=java+developer&l=Dublin&start=30&vjk=793f8636347a9f0b
Frontend Engineer, Workday , https://ie.indeed.com/jobs?q=java+developer&l=Dublin&start=30&vjk=37ac57af7855bc2f
Operations Engineer, Workday , https://ie.indeed.com/jobs?q=java+developer&l=Dublin&start=30&vjk=6cfd63ec6941a2d5
Software Development Engineer  Studio, Workday , https://ie.indeed.com/jobs?q=java+developer&l=Dublin&start=40&vjk=09e979cfa2b060e2
Developer Support Engineer, Paypal , https://ie.indeed.com/jobs?q=java+developer&l=Dublin&start=40&vjk=e5d140564bcd919d
Web Development Engineer  CloudWatch, Amazoncom , https://ie.indeed.com/jobs?q=java+developer&l=Dublin&start=40&vjk=2a967faa1f4a983d
Senior Software Developer Core Server, The Stars Group , https://ie.indeed.com/jobs?q=java+developer&l=Dublin&start=40&vjk=49441619dbe56831
Applications Developer, Oracle , https://ie.indeed.com/jobs?q=java+developer&l=Dublin&start=40&vjk=376b0d234a069b6a
Software Development Engineer, Amazon Data Srvcs Ireland Ltd , https://ie.indeed.com/jobs?q=java+developer&l=Dublin&start=40&vjk=82dd2780da918aa4
Demo Engineer Success Graduate, Salesforce , https://ie.indeed.com/jobs?q=java+developer&l=Dublin&start=40&vjk=4b7938675f979088
Senior Software Engineer  Dublin, BrowserStack , https://ie.indeed.com/jobs?q=java+developer&l=Dublin&start=40&vjk=0dcbf7e2c0f1b6a9
Java Deployment Automation Developer, Jobskey Consultancy , https://ie.indeed.com/jobs?q=java+developer&l=Dublin&start=40&vjk=0247991ee17ca7ae
Application Support Engineer, CarGurus , https://ie.indeed.com/jobs?q=java+developer&l=Dublin&start=40&vjk=909a157120c2edb8
Software Developer 4, Oracle , https://ie.indeed.com/jobs?q=java+developer&l=Dublin&start=50&vjk=2f7c2a52900045ae
Web Developer Support Engineer, Paypal , https://ie.indeed.com/jobs?q=java+developer&l=Dublin&start=50&vjk=4a1c3d0157a419d6
Full Stack JavaUI Engineer  6 Month Day Rate Contract, Globoforce Limited , https://ie.indeed.com/jobs?q=java+developer&l=Dublin&start=50&vjk=aeee11be86ccba58
Data Engineer, Deutsche Bank , https://ie.indeed.com/jobs?q=java+developer&l=Dublin&start=50&vjk=65d2d24e06d52b77
Software Development Engineer  Barcelona event March 2019, Amazoncom , https://ie.indeed.com/jobs?q=java+developer&l=Dublin&start=50&vjk=fea13d30b2b23675
Full Stack Software Engineer EMEA, MongoDB , https://ie.indeed.com/jobs?q=java+developer&l=Dublin&start=50&vjk=ac42671a948e5b17
Data Engineer, Hertz Europe , https://ie.indeed.com/jobs?q=java+developer&l=Dublin&start=50&vjk=f65b2dc7d2c0d383
Developer Support Engineer, Facebook , https://ie.indeed.com/jobs?q=java+developer&l=Dublin&start=50&vjk=3cc3c1e4b2f49f63
Game Server Engineer, DIGIT Game Studios , https://ie.indeed.com/jobs?q=java+developer&l=Dublin&start=50&vjk=bdb4d3bbcf2d8cbf
Full Stack Engineer, Sylon , https://ie.indeed.com/jobs?q=java+developer&l=Dublin&start=50&vjk=55d916b7d52e0505
Junior Data Engineer, Hertz Europe , https://ie.indeed.com/jobs?q=java+developer&l=Dublin&start=60&vjk=39fd2286c675ac58
Liferay Full Stack Developer  Work Remote 4500055000, PFI Knowledge Solutions Ltd , https://ie.indeed.com/jobs?q=java+developer&l=Dublin&start=60&vjk=fd88bcf4f366e1e4
Java Developer with Big Data, Citi , https://ie.indeed.com/jobs?q=java+developer&l=Dublin&start=60&vjk=5cb4e0c1cfb058df
Java  C Software Engineers, Greenfinch , https://ie.indeed.com/jobs?q=java+developer&l=Dublin&start=60&vjk=59afe389af54bdab
Technical Customer Service, AWS EMEA SARL Irish Branch , https://ie.indeed.com/jobs?q=java+developer&l=Dublin&start=60&vjk=047479276e25bc24
Software Engineering Intern PhD 2019, Google , https://ie.indeed.com/jobs?q=java+developer&l=Dublin&start=60&vjk=e13a6b59ea307cea
Software Developer Community Operations Engineering, Facebook , https://ie.indeed.com/jobs?q=java+developer&l=Dublin&start=60&vjk=92b846bcde8c93f8
Engineer Software Engineering, MasterCard , https://ie.indeed.com/jobs?q=java+developer&l=Dublin&start=60&vjk=5e470037c29af132
Graduate Developer Consultant  Dublin Ireland, Guidewire Software Inc , https://ie.indeed.com/jobs?q=java+developer&l=Dublin&start=60&vjk=2bda8a1991f21d4c
Software Developer IBM Cloud Dublin, IBM , https://ie.indeed.com/jobs?q=java+developer&l=Dublin&start=60&vjk=7523812ad54f0149
Solution Developer EMEA Dublin office, Zendesk , https://ie.indeed.com/jobs?q=java+developer&l=Dublin&start=70&vjk=0fdb19eea474028b
FrontEnd Developer, Kylin Prime Group , https://ie.indeed.com/jobs?q=java+developer&l=Dublin&start=70&vjk=3d117962652aa4e0
Senior Software Engineer, FINEOS Corporation , https://ie.indeed.com/jobs?q=java+developer&l=Dublin&start=70&vjk=0cd49a64cf0d9fe5
Front End Developer, NewsWhip , https://ie.indeed.com/jobs?q=java+developer&l=Dublin&start=70&vjk=1cd3b6962da62462
FRONTEND DEVELOPER, SONALAKE , https://ie.indeed.com/jobs?q=java+developer&l=Dublin&start=70&vjk=392ed4a793a8fbf8
Web Development Engineer  CloudWatch, Amazon Data Srvcs Ireland Ltd , https://ie.indeed.com/jobs?q=java+developer&l=Dublin&start=70&vjk=3a6c263a2102b4c5
Premier Support Engineer, Zendesk , https://ie.indeed.com/jobs?q=java+developer&l=Dublin&start=70&vjk=2c2b82e2b6370deb
Salesforce Developer, Allianz Worldwide care , https://ie.indeed.com/jobs?q=java+developer&l=Dublin&start=70&vjk=375e9ff2f1d540e0
AWS Developer, Citco , https://ie.indeed.com/jobs?q=java+developer&l=Dublin&start=70&vjk=050264bbf50850e8
Full Stack Engineer, Shipyard Technology Ventures , https://ie.indeed.com/jobs?q=java+developer&l=Dublin&start=70&vjk=8df3ae62657df7a1
Salesforce Developer, Allianz Worldwide care , https://ie.indeed.com/jobs?q=java+developer&l=Dublin&start=80&vjk=375e9ff2f1d540e0
Software Development Engineer  Lambda, Amazon Data Srvcs Ireland Ltd , https://ie.indeed.com/jobs?q=java+developer&l=Dublin&start=80&vjk=1d290ef3582fae1c
Software Development Engineer  DynamoDB, Amazon Data Srvcs Ireland Ltd , https://ie.indeed.com/jobs?q=java+developer&l=Dublin&start=80&vjk=709ac79ac013e582
Software Developer Fleet Management Systems, Amazon Data Srvcs Ireland Ltd , https://ie.indeed.com/jobs?q=java+developer&l=Dublin&start=80&vjk=cfcd5f10cc0c7513
Data Analyst Trust and Safety Arabic, Google , https://ie.indeed.com/jobs?q=java+developer&l=Dublin&start=80&vjk=d694a7afa20cf2f8
Front End Engineer  Load Balancing Console, Amazon Data Srvcs Ireland Ltd , https://ie.indeed.com/jobs?q=java+developer&l=Dublin&start=80&vjk=f17f94c1eb93e3eb
Software Development Engineer  AWS Elasticache, Amazon Data Srvcs Ireland Ltd , https://ie.indeed.com/jobs?q=java+developer&l=Dublin&start=80&vjk=b350c30c52091574
Android Developer, EDG Software Factory , https://ie.indeed.com/jobs?q=java+developer&l=Dublin&start=80&vjk=7e826ffae992e219
Oracle Analyst and Developer, Dunnes , https://ie.indeed.com/jobs?q=java+developer&l=Dublin&start=80&vjk=0e5144bd9582156d
Technical Solutions Engineer G Suite Google Cloud, Google , https://ie.indeed.com/jobs?q=java+developer&l=Dublin&start=80&vjk=192f49e56249234c
Performance Test Engineer, Workday , https://ie.indeed.com/jobs?q=java+developer&l=Dublin&start=90&vjk=4d35cf6b8153f74a
Oracle Analyst and Developer, Dunnes , https://ie.indeed.com/jobs?q=java+developer&l=Dublin&start=90&vjk=0e5144bd9582156d
Fullstack Software Engineer, Hertz Europe , https://ie.indeed.com/jobs?q=java+developer&l=Dublin&start=90&vjk=51c2e951c17f48f9
Software Development Engineer, ServiceNow , https://ie.indeed.com/jobs?q=java+developer&l=Dublin&start=90&vjk=21e659291ef49ded
Software Developer Fleet Management Systems, Amazoncom , https://ie.indeed.com/jobs?q=java+developer&l=Dublin&start=90&vjk=40fd43db01426320
WebMobile App Developer, CR2 , https://ie.indeed.com/jobs?q=java+developer&l=Dublin&start=90&vjk=5b77a32a338e1b75
Software Architect, Travelport , https://ie.indeed.com/jobs?q=java+developer&l=Dublin&start=90&vjk=8bb4d9870deab4d4
Senior Software Engineer  Internal Products Java, Squarespace , https://ie.indeed.com/jobs?q=java+developer&l=Dublin&start=90&vjk=bc38e6df878df771
Salesforce Developer  Application Dev Engineer, Amazon Data Srvcs Ireland Ltd , https://ie.indeed.com/jobs?q=java+developer&l=Dublin&start=90&vjk=ba740481a1ffcdb1
Erasmus Web Developer, Stay Planet , https://ie.indeed.com/jobs?q=java+developer&l=Dublin&start=90&vjk=4d7bb4d043322e4d
