Web Developer, Software Design , https://ie.indeed.com/jobs?q=web+developer&l=Dublin&start=0&vjk=1cb1c51864fbf695
Web Developer, IPSUS , https://ie.indeed.com/jobs?q=web+developer&l=Dublin&start=0&vjk=d7dafa784e0c02b1
Web Developer, HubSpot , https://ie.indeed.com/jobs?q=web+developer&l=Dublin&start=0&vjk=eb7913c666141e44
UI Web Designer, Matrix Internet , https://ie.indeed.com/jobs?q=web+developer&l=Dublin&start=0&vjk=ed53c481f288797b
Freelance Web Software Tester, Interactive Services , https://ie.indeed.com/jobs?q=web+developer&l=Dublin&start=0&vjk=c23d0b34912b7a4f
Frontend Engineer Ireland, Arcblock Inc , https://ie.indeed.com/jobs?q=web+developer&l=Dublin&start=0&vjk=635d4fadc0b5389e
Demo Engineer Success Graduate, Salesforce , https://ie.indeed.com/jobs?q=web+developer&l=Dublin&start=0&vjk=4b7938675f979088
Software Developer Graduate  Dublin Ireland, Guidewire Software Inc , https://ie.indeed.com/jobs?q=web+developer&l=Dublin&start=0&vjk=f591cbc8b3877015
Graphic DesignerFrontend Digital Media Designer, House of Ireland , https://ie.indeed.com/jobs?q=web+developer&l=Dublin&start=0&vjk=303d3d3456bdd2a3
Web Designer  Wordpress Developer, Evolution Digital , https://ie.indeed.com/jobs?q=web+developer&l=Dublin&start=0&vjk=95950705cc27731c
Software Developer Graduate  Dublin Ireland, Guidewire Software Inc , https://ie.indeed.com/jobs?q=web+developer&l=Dublin&start=10&vjk=f591cbc8b3877015
FrontEnd Developer, Natero , https://ie.indeed.com/jobs?q=web+developer&l=Dublin&start=10&vjk=78a6c1c93171f031
Software Engineer  Web Applications, Truata , https://ie.indeed.com/jobs?q=web+developer&l=Dublin&start=10&vjk=110a4999c0b13469
Web Developer, Chill Insurance , https://ie.indeed.com/jobs?q=web+developer&l=Dublin&start=10&vjk=d19384600b1b0bb9
Junior Email Marketing CoOrdinator,  , https://ie.indeed.com/jobs?q=web+developer&l=Dublin&start=10&vjk=3cc5b8d7e7139a8b
Software Developer, Dataships , https://ie.indeed.com/jobs?q=web+developer&l=Dublin&start=10&vjk=cd70ba276a7e4e41
Software Engineering or Site Reliability Engineering Intern, Google , https://ie.indeed.com/jobs?q=web+developer&l=Dublin&start=10&vjk=6193ada8624f82fb
Frontend Software Developer, RTÉ , https://ie.indeed.com/jobs?q=web+developer&l=Dublin&start=10&vjk=58c5482112404413
Front End Developer Dublin, TicketGuardian , https://ie.indeed.com/jobs?q=web+developer&l=Dublin&start=10&vjk=697ac57f348c7e3d
Software Developer, Eurofins , https://ie.indeed.com/jobs?q=web+developer&l=Dublin&start=10&vjk=fc6bb567c8279701
Frontend Developer, Fluke , https://ie.indeed.com/jobs?q=web+developer&l=Dublin&start=20&vjk=8b29c520a428a18f
UI Developer, Bank of America , https://ie.indeed.com/jobs?q=web+developer&l=Dublin&start=20&vjk=ac86f33e236a2ed2
Software Developer  Intern, Groupon , https://ie.indeed.com/jobs?q=web+developer&l=Dublin&start=20&vjk=760b43367b189551
Software Developer, airG , https://ie.indeed.com/jobs?q=web+developer&l=Dublin&start=20&vjk=5feabe1247ff1d4b
Software Developer, Software Design , https://ie.indeed.com/jobs?q=web+developer&l=Dublin&start=20&vjk=2347a1ee262c68a9
Frontend Engineer, Workday , https://ie.indeed.com/jobs?q=web+developer&l=Dublin&start=20&vjk=37ac57af7855bc2f
FrontEnd Developer, Kylin Prime Group , https://ie.indeed.com/jobs?q=web+developer&l=Dublin&start=20&vjk=3d117962652aa4e0
Summer 2019 Intern Software Developer, Salesforce , https://ie.indeed.com/jobs?q=web+developer&l=Dublin&start=20&vjk=51b8984fb507945b
Full Stack Web Developer, FBD Holdings plc , https://ie.indeed.com/jobs?q=web+developer&l=Dublin&start=20&vjk=193a11dfcab3dba7
Frontend Developer React  Dublin Ireland, Telnyx , https://ie.indeed.com/jobs?q=web+developer&l=Dublin&start=20&vjk=c4aee0045814f222
Front End Developer Dublin, TicketGuardian , https://ie.indeed.com/jobs?q=web+developer&l=Dublin&start=30&vjk=697ac57f348c7e3d
Full Stack Developer, Dublin City University , https://ie.indeed.com/jobs?q=web+developer&l=Dublin&start=30&vjk=6196e7ee617562aa
Python Developer, EdgeTier , https://ie.indeed.com/jobs?q=web+developer&l=Dublin&start=30&vjk=5768f30d3baaf0f4
Senior FrontendUI Developer, Rapid Ratings , https://ie.indeed.com/jobs?q=web+developer&l=Dublin&start=30&vjk=c0763288066e06ae
Apex Developer, Salesforce , https://ie.indeed.com/jobs?q=web+developer&l=Dublin&start=30&vjk=c8d7a4291f5007c2
Website Merchandiser  Dundalk, National Pen , https://ie.indeed.com/jobs?q=web+developer&l=Dublin&start=30&vjk=00f1c04d7ac41af7
Software Developer Graduate  Dublin Ireland, Guidewire Software Inc , https://ie.indeed.com/jobs?q=web+developer&l=Dublin&start=30&vjk=f591cbc8b3877015
Applications Developer, Oracle , https://ie.indeed.com/jobs?q=web+developer&l=Dublin&start=30&vjk=376b0d234a069b6a
Software Developer, Eurofins , https://ie.indeed.com/jobs?q=web+developer&l=Dublin&start=30&vjk=2e0311b1fc53e557
Frontend Software Developer, RTÉ , https://ie.indeed.com/jobs?q=web+developer&l=Dublin&start=30&vjk=58c5482112404413
Software Development Intern, FINEOS Corporation , https://ie.indeed.com/jobs?q=web+developer&l=Dublin&start=40&vjk=b7cde7d4420fcd1b
Full Stack Developer, Dublin City University , https://ie.indeed.com/jobs?q=web+developer&l=Dublin&start=40&vjk=6196e7ee617562aa
Digital Marketing Intern, Orangeworks , https://ie.indeed.com/jobs?q=web+developer&l=Dublin&start=40&vjk=2ce532d9def0af90
MAGENTO FRONTEND DEVELOPER, Monsoon Consulting , https://ie.indeed.com/jobs?q=web+developer&l=Dublin&start=40&vjk=c3da11f0404343ca
BACKENDGO DEVELOPER, 42 CRUNCH , https://ie.indeed.com/jobs?q=web+developer&l=Dublin&start=40&vjk=d043ca2705b7d2bf
The Dock  Junior Front End Engineer, Accenture , https://ie.indeed.com/jobs?q=web+developer&l=Dublin&start=40&vjk=c6b1107c4e0dd742
UI Developer, DemonWare , https://ie.indeed.com/jobs?q=web+developer&l=Dublin&start=40&vjk=9822df96dcfd7da1
UI Developer, Activision , https://ie.indeed.com/jobs?q=web+developer&l=Dublin&start=40&vjk=c78edead625013a5
Fullstack Software Engineer, SoapBox Labs , https://ie.indeed.com/jobs?q=web+developer&l=Dublin&start=40&vjk=df790c252edbb014
Liferay FrontEnd Developer  Work Remote  35000  450, PFI Knowledge Solutions Ltd , https://ie.indeed.com/jobs?q=web+developer&l=Dublin&start=40&vjk=8fa6cfae6b7317f0
Mobile Application Developers, IMS MAXIMS , https://ie.indeed.com/jobs?q=web+developer&l=Dublin&start=50&vjk=d87d39e84c27490e
Fullstack Software Engineer, SoapBox Labs , https://ie.indeed.com/jobs?q=web+developer&l=Dublin&start=50&vjk=df790c252edbb014
Software Developer, eDuce Software , https://ie.indeed.com/jobs?q=web+developer&l=Dublin&start=50&vjk=624c53406747234b
Liferay FrontEnd Developer  Work Remote  35000  450, PFI Knowledge Solutions Ltd , https://ie.indeed.com/jobs?q=web+developer&l=Dublin&start=50&vjk=8fa6cfae6b7317f0
SOFTWARE ENGINEER, SONALAKE , https://ie.indeed.com/jobs?q=web+developer&l=Dublin&start=50&vjk=646012274d154a5e
Principal Full Stack Web Developer, siren , https://ie.indeed.com/jobs?q=web+developer&l=Dublin&start=50&vjk=c15be6e75b4e98e8
Full Stack Developer, BlueBridge Technology , https://ie.indeed.com/jobs?q=web+developer&l=Dublin&start=50&vjk=8d49946fd7b35035
Software Engineer, BrowserStack , https://ie.indeed.com/jobs?q=web+developer&l=Dublin&start=50&vjk=c13282830e2003cc
Junior UX Full Stack Designer, Hertz Europe , https://ie.indeed.com/jobs?q=web+developer&l=Dublin&start=50&vjk=928dca03eb250d90
Java  C Software Engineers, Greenfinch , https://ie.indeed.com/jobs?q=web+developer&l=Dublin&start=50&vjk=59afe389af54bdab
Software Development Engineer, Innopharma Technology , https://ie.indeed.com/jobs?q=web+developer&l=Dublin&start=60&vjk=f30ade4f61b257a8
Erasmus Web Developer, Stay Planet , https://ie.indeed.com/jobs?q=web+developer&l=Dublin&start=60&vjk=4d7bb4d043322e4d
Web Developer, Eden Recruitment , https://ie.indeed.com/jobs?q=web+developer&l=Dublin&start=60&vjk=063f4161509c1b1f
Developer, Intercontinental Exchange , https://ie.indeed.com/jobs?q=web+developer&l=Dublin&start=60&vjk=c910a2c462bc67fd
Software Engineer, Houghton Mifflin Harcourt , https://ie.indeed.com/jobs?q=web+developer&l=Dublin&start=60&vjk=b257644be4b29d6e
Software Engineer Back end  Dublin Ireland, Jet  The Walmart eCommerce Family of Brands , https://ie.indeed.com/jobs?q=web+developer&l=Dublin&start=60&vjk=9c95a0dd7c3e0160
Rails Developer, LearnUpon , https://ie.indeed.com/jobs?q=web+developer&l=Dublin&start=60&vjk=5947d6758cadc432
Full Stack Engineer, Sylon , https://ie.indeed.com/jobs?q=web+developer&l=Dublin&start=60&vjk=55d916b7d52e0505
Software Engineer C, Greenfinch Technology , https://ie.indeed.com/jobs?q=web+developer&l=Dublin&start=60&vjk=9792f643aa91c9f6
Web Development Engineer  CloudWatch, Amazon Data Srvcs Ireland Ltd , https://ie.indeed.com/jobs?q=web+developer&l=Dublin&start=60&vjk=3a6c263a2102b4c5
Front End Developer, Shipyard Technology Ventures , https://ie.indeed.com/jobs?q=web+developer&l=Dublin&start=70&vjk=8648b671bc2a82f4
Oracle Products Story Teller, Oracle , https://ie.indeed.com/jobs?q=web+developer&l=Dublin&start=70&vjk=db11616f24f1e089
Frontend Software Engineer React  Dublin Ireland, Telnyx , https://ie.indeed.com/jobs?q=web+developer&l=Dublin&start=70&vjk=e24f77d0218d08c8
Backend  Platform Engineer, Sportdec , https://ie.indeed.com/jobs?q=web+developer&l=Dublin&start=70&vjk=71a0474b7d804023
Software Java Engineer x, KBC Bank , https://ie.indeed.com/jobs?q=web+developer&l=Dublin&start=70&vjk=ceffe2c20de0f246
Full Stack Developer, SoftwareONE , https://ie.indeed.com/jobs?q=web+developer&l=Dublin&start=70&vjk=f0adf5f22e312811
Website Optimization Manager  Dundalk, National Pen , https://ie.indeed.com/jobs?q=web+developer&l=Dublin&start=70&vjk=4b71d0f25ce29784
Developer, Fenergo , https://ie.indeed.com/jobs?q=web+developer&l=Dublin&start=70&vjk=8db6316baf980ef5
Content Developer, Woodrow Mercer , https://ie.indeed.com/jobs?q=web+developer&l=Dublin&start=70&vjk=5f2cf8ae27c3702f
Golang Engineer  Dublin Ireland, Telnyx , https://ie.indeed.com/jobs?q=web+developer&l=Dublin&start=70&vjk=c9d30699dfbea056
Technical Solutions Engineer G Suite Google Cloud, Google , https://ie.indeed.com/jobs?q=web+developer&l=Dublin&start=80&vjk=192f49e56249234c
Golang Engineer  Dublin Ireland, Telnyx , https://ie.indeed.com/jobs?q=web+developer&l=Dublin&start=80&vjk=c9d30699dfbea056
Python Developer, Blueface , https://ie.indeed.com/jobs?q=web+developer&l=Dublin&start=80&vjk=9883391a7e86ce86
Data Analyst Trust and Safety Arabic, Google , https://ie.indeed.com/jobs?q=web+developer&l=Dublin&start=80&vjk=d694a7afa20cf2f8
Site Reliability Engineer SRE, Thought Industries , https://ie.indeed.com/jobs?q=web+developer&l=Dublin&start=80&vjk=64d978e96017e1c7
Digital Marketing  eCommerce  PPC Executive, House of Ireland , https://ie.indeed.com/jobs?q=web+developer&l=Dublin&start=80&vjk=b631d75c9c9af309
Microsoft Dynamics CRM  DeveloperAnalyst, DAMCO , https://ie.indeed.com/jobs?q=web+developer&l=Dublin&start=80&vjk=0eb89c70362c6193
PHP Developer, Independent News  Media , https://ie.indeed.com/jobs?q=web+developer&l=Dublin&start=80&vjk=d97e8fc329b08b55
Data  ETL Scientist Developer, John Madden  Associates , https://ie.indeed.com/jobs?q=web+developer&l=Dublin&start=80&vjk=d23be645aad4d54c
Sr Front End Engineer, Accela , https://ie.indeed.com/jobs?q=web+developer&l=Dublin&start=80&vjk=411fabfbcfc03dd8
Sr Front End Engineer, Accela , https://ie.indeed.com/jobs?q=web+developer&l=Dublin&start=90&vjk=411fabfbcfc03dd8
Software Engineering Intern PhD 2019, Google , https://ie.indeed.com/jobs?q=web+developer&l=Dublin&start=90&vjk=e13a6b59ea307cea
Enterprise Customer Development Representative Google Cloud, Google , https://ie.indeed.com/jobs?q=web+developer&l=Dublin&start=90&vjk=61011091ea0847b1
Python Developer, EdgeTier , https://ie.indeed.com/jobs?q=web+developer&l=Dublin&start=90&vjk=5768f30d3baaf0f4
NET C Software Developer, Swappsi Software , https://ie.indeed.com/jobs?q=web+developer&l=Dublin&start=90&vjk=c14632238724af9d
Full Stack Software Developer, Hertz Europe , https://ie.indeed.com/jobs?q=web+developer&l=Dublin&start=90&vjk=6b6c053c2931b0f9
iOS Engineer Ireland, Arcblock Inc , https://ie.indeed.com/jobs?q=web+developer&l=Dublin&start=90&vjk=1a2d7ab14d5a145d
Software Developer Fleet Management Systems, Amazon Data Srvcs Ireland Ltd , https://ie.indeed.com/jobs?q=web+developer&l=Dublin&start=90&vjk=cfcd5f10cc0c7513
Java Engineer, Credit Suisse , https://ie.indeed.com/jobs?q=web+developer&l=Dublin&start=90&vjk=94d7d861e35e7f0d
CRM Developer, Ergo , https://ie.indeed.com/jobs?q=web+developer&l=Dublin&start=90&vjk=2b5a21aac3c904ce
