Job,company,url
Software Engineer  Java 6 Month Day Rate Contract, Globoforce Limited , https://ie.indeed.com/jobs?q=java+developer&l=Dublin&start=0&vjk=1198ae6a2aa67313
Software Engineer  Web Applications, Truata , https://ie.indeed.com/jobs?q=java+developer&l=Dublin&start=0&vjk=110a4999c0b13469
Software Developer Graduate  Dublin Ireland, Guidewire Software Inc , https://ie.indeed.com/jobs?q=java+developer&l=Dublin&start=0&vjk=f591cbc8b3877015
Software Development Engineer  Barcelona event March 2019, Amazon Data Srvcs Ireland Ltd , https://ie.indeed.com/jobs?q=java+developer&l=Dublin&start=0&vjk=ab54219b3f954980
Software Engineer Back end  Dublin Ireland, Jet  The Walmart eCommerce Family of Brands , https://ie.indeed.com/jobs?q=java+developer&l=Dublin&start=0&vjk=9c95a0dd7c3e0160
Java Developer, Davy , https://ie.indeed.com/jobs?q=java+developer&l=Dublin&start=0&vjk=cef163fde8d82c1b
Software Development Intern, FINEOS Corporation , https://ie.indeed.com/jobs?q=java+developer&l=Dublin&start=0&vjk=b7cde7d4420fcd1b
Backend Engineer Ireland, Arcblock Inc , https://ie.indeed.com/jobs?q=java+developer&l=Dublin&start=0&vjk=535c6d3339517394
JavaScala Developer conversion to Robotic Process Automatio, MindweaverAI , https://ie.indeed.com/jobs?q=java+developer&l=Dublin&start=0&vjk=358b6850dbe0c120
Software Engineer, Susquehanna , https://ie.indeed.com/jobs?q=java+developer&l=Dublin&start=0&vjk=6142e8470368f687
Java Developer, Citi , https://ie.indeed.com/jobs?q=java+developer&l=Dublin&start=10&vjk=93c86aee8ba4ecc9
Java Software Developer, Realex Payments , https://ie.indeed.com/jobs?q=java+developer&l=Dublin&start=10&vjk=f7e10699ca7826b2
Software Development Engineer  Lambda, Amazon Data Srvcs Ireland Ltd , https://ie.indeed.com/jobs?q=java+developer&l=Dublin&start=10&vjk=1d290ef3582fae1c
Software Development Engineer  DynamoDB, Amazon Data Srvcs Ireland Ltd , https://ie.indeed.com/jobs?q=java+developer&l=Dublin&start=10&vjk=709ac79ac013e582
Junior Mobile Developer, CliniShift , https://ie.indeed.com/jobs?q=java+developer&l=Dublin&start=10&vjk=3bb62a979ac4d0c6
Junior Developer Full Stack, Eskimo Software , https://ie.indeed.com/jobs?q=java+developer&l=Dublin&start=10&vjk=65164134e857e2ee
Junior Fullstack Software Engineer, SoapBox Labs , https://ie.indeed.com/jobs?q=java+developer&l=Dublin&start=10&vjk=aac6b9d71d0db058
Java Engineer, Credit Suisse , https://ie.indeed.com/jobs?q=java+developer&l=Dublin&start=10&vjk=94d7d861e35e7f0d
Java Developer, Murex SAS , https://ie.indeed.com/jobs?q=java+developer&l=Dublin&start=10&vjk=2daa90e0c639aa3c
Full Stack Engineer, Sylon , https://ie.indeed.com/jobs?q=java+developer&l=Dublin&start=10&vjk=55d916b7d52e0505
Java Developer, Version 1 , https://ie.indeed.com/jobs?q=java+developer&l=Dublin&start=20&vjk=386ebcbb051449dc
Java Developer  Dublin, Telnyx , https://ie.indeed.com/jobs?q=java+developer&l=Dublin&start=20&vjk=f934acae6e100317
Junior Java Application Developer, WorkJuggle , https://ie.indeed.com/jobs?q=java+developer&l=Dublin&start=20&vjk=8f5c5692056c2f7c
Software Engineer, Blue Insurance , https://ie.indeed.com/jobs?q=java+developer&l=Dublin&start=20&vjk=57ff85f4ff1e6c1a
Software Engineer, Dun  Bradstreet , https://ie.indeed.com/jobs?q=java+developer&l=Dublin&start=20&vjk=dae69d3ed32384ee
Fullstack Software Engineer, Hertz Europe , https://ie.indeed.com/jobs?q=java+developer&l=Dublin&start=20&vjk=51c2e951c17f48f9
Java  API Developer, Version 1 , https://ie.indeed.com/jobs?q=java+developer&l=Dublin&start=20&vjk=eb5bdbaccb6db4a0
Software Development Engineer, ServiceNow , https://ie.indeed.com/jobs?q=java+developer&l=Dublin&start=20&vjk=21e659291ef49ded
Software Development Engineer  AWS Elasticache, Amazon Data Srvcs Ireland Ltd , https://ie.indeed.com/jobs?q=java+developer&l=Dublin&start=20&vjk=b350c30c52091574
Cloud Backend Developer, Siemens AG , https://ie.indeed.com/jobs?q=java+developer&l=Dublin&start=20&vjk=29d078ea3ff788df
Java  C Software Engineers, Greenfinch , https://ie.indeed.com/jobs?q=java+developer&l=Dublin&start=30&vjk=59afe389af54bdab
Full Stack JavaUI Engineer  6 Month Day Rate Contract, Globoforce Limited , https://ie.indeed.com/jobs?q=java+developer&l=Dublin&start=30&vjk=aeee11be86ccba58
Software Engineer Developer, Fidelity Investments , https://ie.indeed.com/jobs?q=java+developer&l=Dublin&start=30&vjk=afab71e13ef750f4
Summer 2019 Intern Software Developer, Salesforce , https://ie.indeed.com/jobs?q=java+developer&l=Dublin&start=30&vjk=51b8984fb507945b
Java Developer, Singlepoint , https://ie.indeed.com/jobs?q=java+developer&l=Dublin&start=30&vjk=35ee2aa0527d79e8
Software Developer IBM Cloud Dublin, IBM , https://ie.indeed.com/jobs?q=java+developer&l=Dublin&start=30&vjk=7523812ad54f0149
Software Developer Fleet Management Systems, Amazon Data Srvcs Ireland Ltd , https://ie.indeed.com/jobs?q=java+developer&l=Dublin&start=30&vjk=cfcd5f10cc0c7513
AI Software Engineer, Accenture , https://ie.indeed.com/jobs?q=java+developer&l=Dublin&start=30&vjk=fb8422d96ee4718d
Java EE Developer, Ryanair , https://ie.indeed.com/jobs?q=java+developer&l=Dublin&start=30&vjk=ce3137888f98ae13
Application Support Engineer, CarGurus , https://ie.indeed.com/jobs?q=java+developer&l=Dublin&start=30&vjk=909a157120c2edb8
Technical Solutions Engineer G Suite Google Cloud, Google , https://ie.indeed.com/jobs?q=java+developer&l=Dublin&start=40&vjk=192f49e56249234c
Java Developer  Support, Version 1 , https://ie.indeed.com/jobs?q=java+developer&l=Dublin&start=40&vjk=f98bae404094b80f
SOFTWARE ENGINEER, SONALAKE , https://ie.indeed.com/jobs?q=java+developer&l=Dublin&start=40&vjk=646012274d154a5e
Software Developer 4, Oracle , https://ie.indeed.com/jobs?q=java+developer&l=Dublin&start=40&vjk=2f7c2a52900045ae
Java Developer, BearingPoint Ireland , https://ie.indeed.com/jobs?q=java+developer&l=Dublin&start=40&vjk=491d4af065a3417d
Software Applications Support  Jnr Developer, Bond Personnel Group , https://ie.indeed.com/jobs?q=java+developer&l=Dublin&start=40&vjk=697d3aec97ad77fb
Software Engineer, BrowserStack , https://ie.indeed.com/jobs?q=java+developer&l=Dublin&start=40&vjk=c13282830e2003cc
Software Engineer Marketing Engineering  Dublin Ireland, Jet  The Walmart eCommerce Family of Brands , https://ie.indeed.com/jobs?q=java+developer&l=Dublin&start=40&vjk=6ee20308a8f8c08f
Snr Software Development Engineer  AWS DMS, Amazon Data Srvcs Ireland Ltd , https://ie.indeed.com/jobs?q=java+developer&l=Dublin&start=40&vjk=efde48aeac981911
Software Development Engineer  AWS DMS, Amazon Data Srvcs Ireland Ltd , https://ie.indeed.com/jobs?q=java+developer&l=Dublin&start=40&vjk=29def744dcd1fbaa
Fullstack Software Engineer, SoapBox Labs , https://ie.indeed.com/jobs?q=java+developer&l=Dublin&start=50&vjk=df790c252edbb014
Software Engineering or Site Reliability Engineering Intern, Google , https://ie.indeed.com/jobs?q=java+developer&l=Dublin&start=50&vjk=6193ada8624f82fb
Software Engineer II, Rapid7 , https://ie.indeed.com/jobs?q=java+developer&l=Dublin&start=50&vjk=9776efefd5b9e370
Senior Java Developer, Version 1 , https://ie.indeed.com/jobs?q=java+developer&l=Dublin&start=50&vjk=c28647101e8daf79
Full Stack Java Developer, Franchise Direct , https://ie.indeed.com/jobs?q=java+developer&l=Dublin&start=50&vjk=e03a8bc0d02ce473
Ambitious and Experienced java Developer Requried, Xpertivity , https://ie.indeed.com/jobs?q=java+developer&l=Dublin&start=50&vjk=bba899c9da817a2f
Software Development Engineer  Amazon Web Services AWS Cl, Amazon Data Srvcs Ireland Ltd , https://ie.indeed.com/jobs?q=java+developer&l=Dublin&start=50&vjk=35811bda5b21350a
Full Stack Java Developer, Equifax , https://ie.indeed.com/jobs?q=java+developer&l=Dublin&start=50&vjk=d845a19aab5304c7
Junior Data Engineer, Hertz Europe , https://ie.indeed.com/jobs?q=java+developer&l=Dublin&start=50&vjk=39fd2286c675ac58
Web Development Engineer  CloudWatch, Amazon Data Srvcs Ireland Ltd , https://ie.indeed.com/jobs?q=java+developer&l=Dublin&start=50&vjk=3a6c263a2102b4c5
Full Stack Java Developer, Citi , https://ie.indeed.com/jobs?q=java+developer&l=Dublin&start=60&vjk=f73530ee4b84bd1a
Application Support Analyst, Accenture , https://ie.indeed.com/jobs?q=java+developer&l=Dublin&start=60&vjk=06f65c52304e4fed
Equity Finance Developer Programmer, NBC Global Finance , https://ie.indeed.com/jobs?q=java+developer&l=Dublin&start=60&vjk=7c84dd8512e2203d
Systems Development Engineer  TechOps, Amazon Data Srvcs Ireland Ltd , https://ie.indeed.com/jobs?q=java+developer&l=Dublin&start=60&vjk=fcedd68d84ba07e5
Staff Backend Engineer Distributed Systems, CircleCI , https://ie.indeed.com/jobs?q=java+developer&l=Dublin&start=60&vjk=39f5fc222f218b5b
Liferay Full Stack Developer  Work Remote 4500055000, PFI Knowledge Solutions Ltd , https://ie.indeed.com/jobs?q=java+developer&l=Dublin&start=60&vjk=fd88bcf4f366e1e4
FrontEnd Developer, Kylin Prime Group , https://ie.indeed.com/jobs?q=java+developer&l=Dublin&start=60&vjk=3d117962652aa4e0
BACKENDFRONTEND FULL STACK DEVELOPER, Cortex Cognition , https://ie.indeed.com/jobs?q=java+developer&l=Dublin&start=60&vjk=295b355763c54edd
Full Stack Backend  Frontend developer, Cortex Cognition , https://ie.indeed.com/jobs?q=java+developer&l=Dublin&start=60&vjk=6dbffad5115181dc
Senior Java Developer, Amach Software , https://ie.indeed.com/jobs?q=java+developer&l=Dublin&start=60&vjk=00466484a6cb349f
Software Development Engineer, Workday , https://ie.indeed.com/jobs?q=java+developer&l=Dublin&start=70&vjk=e61f09e24bc7fc5f
Software Engineering Intern PhD 2019, Google , https://ie.indeed.com/jobs?q=java+developer&l=Dublin&start=70&vjk=e13a6b59ea307cea
Java Deployment Automation Developer, Jobskey Consultancy , https://ie.indeed.com/jobs?q=java+developer&l=Dublin&start=70&vjk=0247991ee17ca7ae
Software Development Engineer  Studio, Workday , https://ie.indeed.com/jobs?q=java+developer&l=Dublin&start=70&vjk=09e979cfa2b060e2
Software Developer Community Operations Engineering, Facebook , https://ie.indeed.com/jobs?q=java+developer&l=Dublin&start=70&vjk=92b846bcde8c93f8
Android Developer, EDG Software Factory , https://ie.indeed.com/jobs?q=java+developer&l=Dublin&start=70&vjk=7e826ffae992e219
Junior Software Engineer DevOps  Kubernetes Dublin Irela, Jet  The Walmart eCommerce Family of Brands , https://ie.indeed.com/jobs?q=java+developer&l=Dublin&start=70&vjk=519b83ff0d7833b9
Junior Software Engineer DevOps Kafka  Dublin Ireland, Jet  The Walmart eCommerce Family of Brands , https://ie.indeed.com/jobs?q=java+developer&l=Dublin&start=70&vjk=f8e01e646352945c
Operations Engineer, Workday , https://ie.indeed.com/jobs?q=java+developer&l=Dublin&start=70&vjk=6cfd63ec6941a2d5
Senior Java Developer  Dublin, Citi , https://ie.indeed.com/jobs?q=java+developer&l=Dublin&start=70&vjk=5e883f14af1ed786
Full Stack Engineer, Shipyard Technology Ventures , https://ie.indeed.com/jobs?q=java+developer&l=Dublin&start=80&vjk=8df3ae62657df7a1
Senior Software Engineer  Dublin, BrowserStack , https://ie.indeed.com/jobs?q=java+developer&l=Dublin&start=80&vjk=0dcbf7e2c0f1b6a9
Technical Customer Service, AWS EMEA SARL Irish Branch , https://ie.indeed.com/jobs?q=java+developer&l=Dublin&start=80&vjk=047479276e25bc24
Full Stack Software Engineer EMEA, MongoDB , https://ie.indeed.com/jobs?q=java+developer&l=Dublin&start=80&vjk=ac42671a948e5b17
Software Engineer  Cloud ES, Microsoft , https://ie.indeed.com/jobs?q=java+developer&l=Dublin&start=80&vjk=6d4e05f7e584159d
Software Developer Watson Cloud  Platform, IBM , https://ie.indeed.com/jobs?q=java+developer&l=Dublin&start=80&vjk=51173f1b4299e16d
Software Test Engineer IBM Cloud Dublin, IBM , https://ie.indeed.com/jobs?q=java+developer&l=Dublin&start=80&vjk=e55ba29dee123407
SAP iXp Intern  Software Developer January Start  6 month, SAP , https://ie.indeed.com/jobs?q=java+developer&l=Dublin&start=80&vjk=647cecbfdd1ef89b
Technical Support Representative Tier 3  SpringCM, DocuSign , https://ie.indeed.com/jobs?q=java+developer&l=Dublin&start=80&vjk=9f854ca6071e14e1
FrontEnd Developer, News Whip , https://ie.indeed.com/jobs?q=java+developer&l=Dublin&start=80&vjk=1da0e7fb5187a607
Software Applications Support  Junior Software Developer, Bond Personnel , https://ie.indeed.com/jobs?q=java+developer&l=Dublin&start=90&vjk=ecf6d8c4df54f617
Applications Developer, Oracle , https://ie.indeed.com/jobs?q=java+developer&l=Dublin&start=90&vjk=376b0d234a069b6a
Java Developer, nineDots , https://ie.indeed.com/jobs?q=java+developer&l=Dublin&start=90&vjk=1fb751bbe9e50612
Data Engineer, Deutsche Bank , https://ie.indeed.com/jobs?q=java+developer&l=Dublin&start=90&vjk=65d2d24e06d52b77
Salesforce Developer  Application Dev Engineer, Amazon Data Srvcs Ireland Ltd , https://ie.indeed.com/jobs?q=java+developer&l=Dublin&start=90&vjk=ba740481a1ffcdb1
Performance Engineer, Workday , https://ie.indeed.com/jobs?q=java+developer&l=Dublin&start=90&vjk=4d35cf6b8153f74a
Front End Developer, NewsWhip , https://ie.indeed.com/jobs?q=java+developer&l=Dublin&start=90&vjk=1cd3b6962da62462
Java Developer with Big Data, Citi , https://ie.indeed.com/jobs?q=java+developer&l=Dublin&start=90&vjk=5cb4e0c1cfb058df
Senior Software Engineer, Twilio , https://ie.indeed.com/jobs?q=java+developer&l=Dublin&start=90&vjk=1ea4ca1584150ab5
Web FrontEnd Developer, Greenfinch , https://ie.indeed.com/jobs?q=java+developer&l=Dublin&start=90&vjk=a173dc3c6cbc717a
