Software Engineering or Site Reliability Engineering Intern, Google , https://ie.indeed.com/jobs?q=java+developer&l=Dublin&start=0&vjk=6193ada8624f82fb
Software Java Engineer x, KBC Bank , https://ie.indeed.com/jobs?q=java+developer&l=Dublin&start=0&vjk=ceffe2c20de0f246
Software Developer Graduate  Dublin Ireland, Guidewire Software Inc , https://ie.indeed.com/jobs?q=java+developer&l=Dublin&start=0&vjk=f591cbc8b3877015
Summer 2019 Intern Software Developer, Salesforce , https://ie.indeed.com/jobs?q=java+developer&l=Dublin&start=0&vjk=51b8984fb507945b
Software Developer  Intern, Groupon , https://ie.indeed.com/jobs?q=java+developer&l=Dublin&start=0&vjk=760b43367b189551
Junior Developer Full Stack, Eskimo Software , https://ie.indeed.com/jobs?q=java+developer&l=Dublin&start=0&vjk=65164134e857e2ee
Software Developer IBM Cloud Dublin, IBM , https://ie.indeed.com/jobs?q=java+developer&l=Dublin&start=0&vjk=7523812ad54f0149
Java Engineer, Credit Suisse , https://ie.indeed.com/jobs?q=java+developer&l=Dublin&start=0&vjk=94d7d861e35e7f0d
Java Software Developer, Realex Payments , https://ie.indeed.com/jobs?q=java+developer&l=Dublin&start=0&vjk=f7e10699ca7826b2
Java Developer, Citi , https://ie.indeed.com/jobs?q=java+developer&l=Dublin&start=0&vjk=93c86aee8ba4ecc9
Java Developer, Version 1 , https://ie.indeed.com/jobs?q=java+developer&l=Dublin&start=10&vjk=386ebcbb051449dc
Java Developer, Davy , https://ie.indeed.com/jobs?q=java+developer&l=Dublin&start=10&vjk=cef163fde8d82c1b
Software Development Intern, FINEOS Corporation , https://ie.indeed.com/jobs?q=java+developer&l=Dublin&start=10&vjk=b7cde7d4420fcd1b
Java  API Developer, Version 1 , https://ie.indeed.com/jobs?q=java+developer&l=Dublin&start=10&vjk=eb5bdbaccb6db4a0
Java Developer, Murex SAS , https://ie.indeed.com/jobs?q=java+developer&l=Dublin&start=10&vjk=2daa90e0c639aa3c
Software Engineer Developer, Fidelity Investments , https://ie.indeed.com/jobs?q=java+developer&l=Dublin&start=10&vjk=7191ea69df944885
JavaScala Developer conversion to Robotic Process Automatio, MindweaverAI , https://ie.indeed.com/jobs?q=java+developer&l=Dublin&start=10&vjk=358b6850dbe0c120
Software Engineer  Web Applications, Truata , https://ie.indeed.com/jobs?q=java+developer&l=Dublin&start=10&vjk=110a4999c0b13469
Java Developer, Singlepoint , https://ie.indeed.com/jobs?q=java+developer&l=Dublin&start=10&vjk=35ee2aa0527d79e8
Software Engineering Intern PhD 2019, Google , https://ie.indeed.com/jobs?q=java+developer&l=Dublin&start=10&vjk=e13a6b59ea307cea
Software Engineer  Web Applications, Truata , https://ie.indeed.com/jobs?q=java+developer&l=Dublin&start=20&vjk=110a4999c0b13469
Java EE Developer, Ryanair , https://ie.indeed.com/jobs?q=java+developer&l=Dublin&start=20&vjk=ce3137888f98ae13
Java  C Software Engineers, Greenfinch , https://ie.indeed.com/jobs?q=java+developer&l=Dublin&start=20&vjk=59afe389af54bdab
Java Developer, BearingPoint Ireland , https://ie.indeed.com/jobs?q=java+developer&l=Dublin&start=20&vjk=491d4af065a3417d
Software Engineer Back end  Dublin Ireland, Jet  The Walmart eCommerce Family of Brands , https://ie.indeed.com/jobs?q=java+developer&l=Dublin&start=20&vjk=9c95a0dd7c3e0160
Web Development Engineer  CloudWatch, Amazon Data Srvcs Ireland Ltd , https://ie.indeed.com/jobs?q=java+developer&l=Dublin&start=20&vjk=3a6c263a2102b4c5
SOFTWARE ENGINEER, SONALAKE , https://ie.indeed.com/jobs?q=java+developer&l=Dublin&start=20&vjk=646012274d154a5e
Software Engineer, BrowserStack , https://ie.indeed.com/jobs?q=java+developer&l=Dublin&start=20&vjk=c13282830e2003cc
Fullstack Software Engineer, SoapBox Labs , https://ie.indeed.com/jobs?q=java+developer&l=Dublin&start=20&vjk=df790c252edbb014
Software Developer Community Operations Engineering, Facebook , https://ie.indeed.com/jobs?q=java+developer&l=Dublin&start=20&vjk=92b846bcde8c93f8
Backend Engineer Ireland, Arcblock Inc , https://ie.indeed.com/jobs?q=java+developer&l=Dublin&start=30&vjk=535c6d3339517394
Frontend Engineer, Workday , https://ie.indeed.com/jobs?q=java+developer&l=Dublin&start=30&vjk=37ac57af7855bc2f
Developer, Intercontinental Exchange , https://ie.indeed.com/jobs?q=java+developer&l=Dublin&start=30&vjk=c910a2c462bc67fd
Software Developer Community Operations Engineering, Facebook , https://ie.indeed.com/jobs?q=java+developer&l=Dublin&start=30&vjk=92b846bcde8c93f8
Software Engineer, Susquehanna , https://ie.indeed.com/jobs?q=java+developer&l=Dublin&start=30&vjk=6142e8470368f687
Software Engineer, Dun  Bradstreet , https://ie.indeed.com/jobs?q=java+developer&l=Dublin&start=30&vjk=dae69d3ed32384ee
Software Developer  Internship, AdaptiveMobile Security , https://ie.indeed.com/jobs?q=java+developer&l=Dublin&start=30&vjk=f98a4fddb066613b
React Native Developer, Finsearch Professional Recruitment , https://ie.indeed.com/jobs?q=java+developer&l=Dublin&start=30&vjk=0aa96fb68254c6cd
Engineer Software Engineering, MasterCard , https://ie.indeed.com/jobs?q=java+developer&l=Dublin&start=30&vjk=5e470037c29af132
Cloud Backend Developer, Siemens AG , https://ie.indeed.com/jobs?q=java+developer&l=Dublin&start=30&vjk=29d078ea3ff788df
Full Stack JavaUI Engineer  6 Month Day Rate Contract, Globoforce Limited , https://ie.indeed.com/jobs?q=java+developer&l=Dublin&start=40&vjk=aeee11be86ccba58
Full Stack Java Developer, Citi , https://ie.indeed.com/jobs?q=java+developer&l=Dublin&start=40&vjk=f73530ee4b84bd1a
Software Developer Fleet Management Systems, Amazon Data Srvcs Ireland Ltd , https://ie.indeed.com/jobs?q=java+developer&l=Dublin&start=40&vjk=cfcd5f10cc0c7513
Application Support Engineer, CarGurus , https://ie.indeed.com/jobs?q=java+developer&l=Dublin&start=40&vjk=909a157120c2edb8
Salesforce Developer  Application Dev Engineer, Amazon Data Srvcs Ireland Ltd , https://ie.indeed.com/jobs?q=java+developer&l=Dublin&start=40&vjk=ba740481a1ffcdb1
Senior Java Developer, Amach Software , https://ie.indeed.com/jobs?q=java+developer&l=Dublin&start=40&vjk=00466484a6cb349f
Student Research Collaboration, Google , https://ie.indeed.com/jobs?q=java+developer&l=Dublin&start=40&vjk=5bf6b55729fdb762
Senior Software Engineer  Dublin, BrowserStack , https://ie.indeed.com/jobs?q=java+developer&l=Dublin&start=40&vjk=0dcbf7e2c0f1b6a9
Developer Support Engineer, Facebook , https://ie.indeed.com/jobs?q=java+developer&l=Dublin&start=40&vjk=3cc3c1e4b2f49f63
Salesforce Developer, Allianz Worldwide care , https://ie.indeed.com/jobs?q=java+developer&l=Dublin&start=40&vjk=375e9ff2f1d540e0
Full Stack Backend  Frontend developer, Cortex Cognition , https://ie.indeed.com/jobs?q=java+developer&l=Dublin&start=50&vjk=6dbffad5115181dc
Software Development Engineer  Barcelona event March 2019, Amazon Data Srvcs Ireland Ltd , https://ie.indeed.com/jobs?q=java+developer&l=Dublin&start=50&vjk=ab54219b3f954980
Java Deployment Automation Developer, Jobskey Consultancy , https://ie.indeed.com/jobs?q=java+developer&l=Dublin&start=50&vjk=0247991ee17ca7ae
BACKENDFRONTEND FULL STACK DEVELOPER, Cortex Cognition , https://ie.indeed.com/jobs?q=java+developer&l=Dublin&start=50&vjk=295b355763c54edd
Liferay Full Stack Developer  Work Remote 4500055000, PFI Knowledge Solutions Ltd , https://ie.indeed.com/jobs?q=java+developer&l=Dublin&start=50&vjk=fd88bcf4f366e1e4
Senior Java Developer, Version 1 , https://ie.indeed.com/jobs?q=java+developer&l=Dublin&start=50&vjk=c28647101e8daf79
ETL Developer, ProvidentCRM Limited , https://ie.indeed.com/jobs?q=java+developer&l=Dublin&start=50&vjk=ea2ca87cb04a9546
Full Stack Software Developer, Hertz Europe , https://ie.indeed.com/jobs?q=java+developer&l=Dublin&start=50&vjk=6b6c053c2931b0f9
Principal Full Stack Web Developer, siren , https://ie.indeed.com/jobs?q=java+developer&l=Dublin&start=50&vjk=c15be6e75b4e98e8
Java Developers Dublin, Sigmar Recruitment , https://ie.indeed.com/jobs?q=java+developer&l=Dublin&start=50&vjk=e5c498790bb5018f
Java Developer  Support, Version 1 , https://ie.indeed.com/jobs?q=java+developer&l=Dublin&start=60&vjk=f98bae404094b80f
Senior Java  JavaScript developers remote job, Alto Analytics SL , https://ie.indeed.com/jobs?q=java+developer&l=Dublin&start=60&vjk=72e280c2a9eb0725
Operations Engineer, Workday , https://ie.indeed.com/jobs?q=java+developer&l=Dublin&start=60&vjk=6cfd63ec6941a2d5
Game Server Engineer, DIGIT Game Studios , https://ie.indeed.com/jobs?q=java+developer&l=Dublin&start=60&vjk=bdb4d3bbcf2d8cbf
Senior Software Developer Core Server, The Stars Group , https://ie.indeed.com/jobs?q=java+developer&l=Dublin&start=60&vjk=49441619dbe56831
Java Developer with Big Data, Citi , https://ie.indeed.com/jobs?q=java+developer&l=Dublin&start=60&vjk=5cb4e0c1cfb058df
Software Developer Big Data  Analytics, Truata , https://ie.indeed.com/jobs?q=java+developer&l=Dublin&start=60&vjk=fb93fb19a3a07663
Staff Site Reliability Engineer, CircleCI , https://ie.indeed.com/jobs?q=java+developer&l=Dublin&start=60&vjk=5c84b39504a19226
FrontEnd Developer, Kylin Prime Group , https://ie.indeed.com/jobs?q=java+developer&l=Dublin&start=60&vjk=3d117962652aa4e0
Software Development Engineer  Lambda, Amazon Data Srvcs Ireland Ltd , https://ie.indeed.com/jobs?q=java+developer&l=Dublin&start=60&vjk=1d290ef3582fae1c
Software Development Engineer  DynamoDB, Amazon Data Srvcs Ireland Ltd , https://ie.indeed.com/jobs?q=java+developer&l=Dublin&start=70&vjk=709ac79ac013e582
MidLevel Developers  Learn New Tech, Archer , https://ie.indeed.com/jobs?q=java+developer&l=Dublin&start=70&vjk=845d7c36770b22c8
Android Developer, EDG Software Factory , https://ie.indeed.com/jobs?q=java+developer&l=Dublin&start=70&vjk=7e826ffae992e219
Demo Engineer Success Graduate, Salesforce , https://ie.indeed.com/jobs?q=java+developer&l=Dublin&start=70&vjk=4b7938675f979088
Senior Software Engineer  Internal Products Java, Squarespace , https://ie.indeed.com/jobs?q=java+developer&l=Dublin&start=70&vjk=bc38e6df878df771
Applications Developer, Oracle , https://ie.indeed.com/jobs?q=java+developer&l=Dublin&start=70&vjk=376b0d234a069b6a
Erasmus Web Developer, Stay Planet , https://ie.indeed.com/jobs?q=java+developer&l=Dublin&start=70&vjk=4d7bb4d043322e4d
Ambitious and Experienced java Developer Requried, Xpertivity , https://ie.indeed.com/jobs?q=java+developer&l=Dublin&start=70&vjk=bba899c9da817a2f
Full Stack Software Engineer EMEA, MongoDB , https://ie.indeed.com/jobs?q=java+developer&l=Dublin&start=70&vjk=ac42671a948e5b17
Equity Finance Developer Programmer, NBC Global Finance , https://ie.indeed.com/jobs?q=java+developer&l=Dublin&start=70&vjk=7c84dd8512e2203d
Systems Development Engineer  TechOps, Amazon Data Srvcs Ireland Ltd , https://ie.indeed.com/jobs?q=java+developer&l=Dublin&start=80&vjk=fcedd68d84ba07e5
Full Stack Java Developer, Franchise Direct , https://ie.indeed.com/jobs?q=java+developer&l=Dublin&start=80&vjk=e03a8bc0d02ce473
AWS Developer, Citco , https://ie.indeed.com/jobs?q=java+developer&l=Dublin&start=80&vjk=050264bbf50850e8
Digital Automation Lead, Aer Lingus Group plc , https://ie.indeed.com/jobs?q=java+developer&l=Dublin&start=80&vjk=fe177e980025e46b
AI Software Engineer, Accenture , https://ie.indeed.com/jobs?q=java+developer&l=Dublin&start=80&vjk=fb8422d96ee4718d
Onsite Full Stack JavaJavaScript Developer, eSpatial , https://ie.indeed.com/jobs?q=java+developer&l=Dublin&start=80&vjk=a64899c1c78eb241
Oracle Analyst and Developer, Dunnes , https://ie.indeed.com/jobs?q=java+developer&l=Dublin&start=80&vjk=0e5144bd9582156d
Android Engineer  Dublin Ireland, Jet  The Walmart eCommerce Family of Brands , https://ie.indeed.com/jobs?q=java+developer&l=Dublin&start=80&vjk=d78939bf1c3101e0
Frontend Software Engineer React  Dublin Ireland, Telnyx , https://ie.indeed.com/jobs?q=java+developer&l=Dublin&start=80&vjk=e24f77d0218d08c8
Graduate Developer Consultant  Dublin Ireland, Guidewire Software Inc , https://ie.indeed.com/jobs?q=java+developer&l=Dublin&start=80&vjk=2bda8a1991f21d4c
CUnity Engineer, Zendesk , https://ie.indeed.com/jobs?q=java+developer&l=Dublin&start=90&vjk=9b974fa5be082e5e
Onsite Full Stack JavaJavaScript Developer, eSpatial , https://ie.indeed.com/jobs?q=java+developer&l=Dublin&start=90&vjk=a64899c1c78eb241
Frontend Software Engineer React  Dublin Ireland, Telnyx , https://ie.indeed.com/jobs?q=java+developer&l=Dublin&start=90&vjk=e24f77d0218d08c8
Software Developer 4, Oracle , https://ie.indeed.com/jobs?q=java+developer&l=Dublin&start=90&vjk=2f7c2a52900045ae
Software Development Engineer, ServiceNow , https://ie.indeed.com/jobs?q=java+developer&l=Dublin&start=90&vjk=21e659291ef49ded
Full Stack Engineer, Sylon , https://ie.indeed.com/jobs?q=java+developer&l=Dublin&start=90&vjk=55d916b7d52e0505
Frontend Developer, Zone , https://ie.indeed.com/jobs?q=java+developer&l=Dublin&start=90&vjk=62f1931a73744b40
Software Test Engineer IBM Cloud Dublin, IBM , https://ie.indeed.com/jobs?q=java+developer&l=Dublin&start=90&vjk=e55ba29dee123407
Fullstack Software Engineer, Hertz Europe , https://ie.indeed.com/jobs?q=java+developer&l=Dublin&start=90&vjk=51c2e951c17f48f9
Penetration Tester, Micro Focus , https://ie.indeed.com/jobs?q=java+developer&l=Dublin&start=90&vjk=5625d099e8c1cc67
