iOS Developer, LetsGetChecked , https://ie.indeed.com/jobs?q=ios+developer&l=Dublin&start=0&vjk=574f7dc2d385d0e4
iOS Developer, Test Triange LTD , https://ie.indeed.com/jobs?q=ios+developer&l=Dublin&start=0&vjk=6874db0b587dabb5
iOS App Developer, firecom , https://ie.indeed.com/jobs?q=ios+developer&l=Dublin&start=0&vjk=84c6c0edf0b58fea
iOS Engineer Ireland, Arcblock Inc , https://ie.indeed.com/jobs?q=ios+developer&l=Dublin&start=0&vjk=1a2d7ab14d5a145d
Software Developer C, Zulleon , https://ie.indeed.com/jobs?q=ios+developer&l=Dublin&start=0&vjk=0af1681233efda5c
Unity3D Developer, Black Onyx Interactive , https://ie.indeed.com/jobs?q=ios+developer&l=Dublin&start=0&vjk=a94f0bd40ea35854
Senior iOS Developer, HubSpot , https://ie.indeed.com/jobs?q=ios+developer&l=Dublin&start=0&vjk=f8509f3e2641ff6f
iOS Developer, nineDots , https://ie.indeed.com/jobs?q=ios+developer&l=Dublin&start=0&vjk=62c14a4c4278777c
Software Developer, Zulleon , https://ie.indeed.com/jobs?q=ios+developer&l=Dublin&start=0&vjk=e4c6497852aa86ea
Senior IOS Software Development Engineer, Workday , https://ie.indeed.com/jobs?q=ios+developer&l=Dublin&start=0&vjk=d457a518686a97c2
iOS Developer, Gempool , https://ie.indeed.com/jobs?q=ios+developer&l=Dublin&start=10&vjk=c3938f70fe323e44
Mobile Developer, Dublin City University , https://ie.indeed.com/jobs?q=ios+developer&l=Dublin&start=10&vjk=eb13f68a3e58e171
Senior iOS Developer, Travelport , https://ie.indeed.com/jobs?q=ios+developer&l=Dublin&start=10&vjk=303041787fc8fa45
Senior iOS Developer 6 Month Contract, Distilled SCH , https://ie.indeed.com/jobs?q=ios+developer&l=Dublin&start=10&vjk=0c813cb498a9dfb3
iOS Developer  Contract, Vantage Resources , https://ie.indeed.com/jobs?q=ios+developer&l=Dublin&start=10&vjk=4d75f5511261e277
iOS Developer Swift Contract, realTime , https://ie.indeed.com/jobs?q=ios+developer&l=Dublin&start=10&vjk=cfda362689107d66
Mobile Application Developers, IMS MAXIMS , https://ie.indeed.com/jobs?q=ios+developer&l=Dublin&start=10&vjk=d87d39e84c27490e
Mobile Architect, Verizon , https://ie.indeed.com/jobs?q=ios+developer&l=Dublin&start=10&vjk=080927d77124641d
Android Developer, LetsGetChecked , https://ie.indeed.com/jobs?q=ios+developer&l=Dublin&start=10&vjk=a90a5ca4168dcbf2
Senior Software Engineer  Dublin, BrowserStack , https://ie.indeed.com/jobs?q=ios+developer&l=Dublin&start=10&vjk=0dcbf7e2c0f1b6a9
Senior Web Developer, TheJournalie , https://ie.indeed.com/jobs?q=ios+developer&l=Dublin&start=20&vjk=b73f79f907cd75f1
Systems Engineer, MacStadium , https://ie.indeed.com/jobs?q=ios+developer&l=Dublin&start=20&vjk=d393521c0e36274f
Software Engineer, BrowserStack , https://ie.indeed.com/jobs?q=ios+developer&l=Dublin&start=20&vjk=c13282830e2003cc
Senior iOS Developer, realTime , https://ie.indeed.com/jobs?q=ios+developer&l=Dublin&start=20&vjk=be26101ddc8dd015
Xamarin Developer  South Dublin, IT Search , https://ie.indeed.com/jobs?q=ios+developer&l=Dublin&start=20&vjk=8ba444d052a05429
Senior Game Client Engineer Unity, DIGIT Game Studios , https://ie.indeed.com/jobs?q=ios+developer&l=Dublin&start=20&vjk=bad601fc3834cc59
UIMobile Build and Release Engineer, Workday , https://ie.indeed.com/jobs?q=ios+developer&l=Dublin&start=20&vjk=793f8636347a9f0b
React Native Developer, Finsearch Professional Recruitment , https://ie.indeed.com/jobs?q=ios+developer&l=Dublin&start=20&vjk=0aa96fb68254c6cd
Senior Software Developer C, Zulleon , https://ie.indeed.com/jobs?q=ios+developer&l=Dublin&start=20&vjk=db7b0a0c02d1e3bf
Developer Emobility, Wipro LTD , https://ie.indeed.com/jobs?q=ios+developer&l=Dublin&start=20&vjk=ea80f1f59efbb969
Fullstack Software Engineer, Hertz Europe , https://ie.indeed.com/jobs?q=ios+developer&l=Dublin&start=30&vjk=51c2e951c17f48f9
iOS Android Developer  Mobile Developer, Nicoll Curtin Limited , https://ie.indeed.com/jobs?q=ios+developer&l=Dublin&start=30&vjk=36d45ff749724ec5
Software Architect, Travelport , https://ie.indeed.com/jobs?q=ios+developer&l=Dublin&start=30&vjk=8bb4d9870deab4d4
Senior Unity3D Developer, Zulleon , https://ie.indeed.com/jobs?q=ios+developer&l=Dublin&start=30&vjk=a3b312b379ef203f
Senior NET Developer, Flipdish , https://ie.indeed.com/jobs?q=ios+developer&l=Dublin&start=30&vjk=98003718a20c798f
Mobile Developer, Reperio Human Capital , https://ie.indeed.com/jobs?q=ios+developer&l=Dublin&start=30&vjk=4ef1c87e4686ed05
Senior Network Engineer, ServiceNow , https://ie.indeed.com/jobs?q=ios+developer&l=Dublin&start=30&vjk=e8f2aa90f75b1f0d
Backend  Platform Engineer, Sportdec , https://ie.indeed.com/jobs?q=ios+developer&l=Dublin&start=30&vjk=71a0474b7d804023
Customer Support Technician, MacStadium , https://ie.indeed.com/jobs?q=ios+developer&l=Dublin&start=30&vjk=29cdc69b7ac1779f
Technical Support Engineer, Twilio , https://ie.indeed.com/jobs?q=ios+developer&l=Dublin&start=30&vjk=325b6660596b4b58
Technical Support Engineer, Twilio , https://ie.indeed.com/jobs?q=ios+developer&l=Dublin&start=40&vjk=325b6660596b4b58
Software Engineering Manager  Mobile, Accela , https://ie.indeed.com/jobs?q=ios+developer&l=Dublin&start=40&vjk=5fea3b1712d2aa8c
Squad Lead, Verizon , https://ie.indeed.com/jobs?q=ios+developer&l=Dublin&start=40&vjk=7eb367e7ccef2c1b
Cloud Support Engineer Developer and Mobile Services  AWS, AWS EMEA SARL Irish Branch , https://ie.indeed.com/jobs?q=ios+developer&l=Dublin&start=40&vjk=51bfe4c8406aac0b
Junior UX Full Stack Designer, Hertz Europe , https://ie.indeed.com/jobs?q=ios+developer&l=Dublin&start=40&vjk=928dca03eb250d90
Erasmus Web Developer, Stay Planet , https://ie.indeed.com/jobs?q=ios+developer&l=Dublin&start=40&vjk=4d7bb4d043322e4d
Senior Test Engineer, Independent News  Media , https://ie.indeed.com/jobs?q=ios+developer&l=Dublin&start=40&vjk=2fb831c277eabf1e
WebMobile Developer, Reperio Human Capital , https://ie.indeed.com/jobs?q=ios+developer&l=Dublin&start=40&vjk=f63b0715eab018d9
Support Engineer, Intercom , https://ie.indeed.com/jobs?q=ios+developer&l=Dublin&start=40&vjk=e8745ab765efbd68
Apps Technical Product Specialist Online Partnerships Group, Google , https://ie.indeed.com/jobs?q=ios+developer&l=Dublin&start=40&vjk=b37778817195c11b
CUnity Engineer, Zendesk , https://ie.indeed.com/jobs?q=ios+developer&l=Dublin&start=50&vjk=9b974fa5be082e5e
The Dock  Scrum Master, Accenture , https://ie.indeed.com/jobs?q=ios+developer&l=Dublin&start=50&vjk=58bae6456c8fc4f1
Full Stack Developer, Reperio Human Capital , https://ie.indeed.com/jobs?q=ios+developer&l=Dublin&start=50&vjk=3722cfd56a6b5f95
UX Developer, Sportdec , https://ie.indeed.com/jobs?q=ios+developer&l=Dublin&start=50&vjk=fa960e2b4b7dfe84
UI Designer, LetsGetChecked , https://ie.indeed.com/jobs?q=ios+developer&l=Dublin&start=50&vjk=693d0431155bf860
Senior Engineer, Reperio Human Capital , https://ie.indeed.com/jobs?q=ios+developer&l=Dublin&start=50&vjk=fc7d1707659a3a5e
Java EE Developer, Ryanair , https://ie.indeed.com/jobs?q=ios+developer&l=Dublin&start=50&vjk=ce3137888f98ae13
Ruby on Rails Developer, Bizimply , https://ie.indeed.com/jobs?q=ios+developer&l=Dublin&start=50&vjk=54124bbcd3740d72
Backend Developer, Bamboo , https://ie.indeed.com/jobs?q=ios+developer&l=Dublin&start=50&vjk=738b86b8dbb8fa4c
Senior Developer  FinTech StartUp  Dublin, Reperio Human Capital , https://ie.indeed.com/jobs?q=ios+developer&l=Dublin&start=50&vjk=042b5cbbcb3fc955
Junior PHP Developer, Reperio Human Capital , https://ie.indeed.com/jobs?q=ios+developer&l=Dublin&start=60&vjk=7b3156b5ebf349ac
Senior Android Mobile Engineer, MasterCard , https://ie.indeed.com/jobs?q=ios+developer&l=Dublin&start=60&vjk=e7c8574c2979983e
Technical Support Engineer  German speaker, Zendesk , https://ie.indeed.com/jobs?q=ios+developer&l=Dublin&start=60&vjk=30a44765cddfe1e1
Exciting New Front End Development Opportunity, Reperio Human Capital , https://ie.indeed.com/jobs?q=ios+developer&l=Dublin&start=60&vjk=92693fb2ba17be8b
Digital Technical Project Manager  Award winning agency, RightFitie , https://ie.indeed.com/jobs?q=ios+developer&l=Dublin&start=60&vjk=23652c158487236a
Mobile Test Engineer, Reperio Human Capital , https://ie.indeed.com/jobs?q=ios+developer&l=Dublin&start=60&vjk=542e51f13912025d
JavaScript Developer, Eolas Recruitment , https://ie.indeed.com/jobs?q=ios+developer&l=Dublin&start=60&vjk=0b8f2562f92dca16
Senior C Net Developer  Dublin CC Start Up, Reperio Human Capital , https://ie.indeed.com/jobs?q=ios+developer&l=Dublin&start=60&vjk=70bde970eafaa98b
UX Full Stack Designer, Hertz Europe , https://ie.indeed.com/jobs?q=ios+developer&l=Dublin&start=60&vjk=c97c762f678a583a
Full Stack PHP Developer, Reperio Human Capital , https://ie.indeed.com/jobs?q=ios+developer&l=Dublin&start=60&vjk=f96d57dccfc6c195
Technical Digital Project Manager, RightFitie , https://ie.indeed.com/jobs?q=ios+developer&l=Dublin&start=70&vjk=f259233d513a3773
Full Stack Software Developer, Eolas Recruitment , https://ie.indeed.com/jobs?q=ios+developer&l=Dublin&start=70&vjk=4f8328e01d21aa2f
Junior PHP Developer, Reperio Human Capital , https://ie.indeed.com/jobs?q=ios+developer&l=Dublin&start=80&vjk=7b3156b5ebf349ac
Exciting New Front End Development Opportunity, Reperio Human Capital , https://ie.indeed.com/jobs?q=ios+developer&l=Dublin&start=80&vjk=92693fb2ba17be8b
Digital Technical Project Manager  Award winning agency, RightFitie , https://ie.indeed.com/jobs?q=ios+developer&l=Dublin&start=80&vjk=23652c158487236a
Mobile Test Engineer, Reperio Human Capital , https://ie.indeed.com/jobs?q=ios+developer&l=Dublin&start=80&vjk=542e51f13912025d
UX Full Stack Designer, Hertz Europe , https://ie.indeed.com/jobs?q=ios+developer&l=Dublin&start=80&vjk=c97c762f678a583a
Senior C Net Developer  Dublin CC Start Up, Reperio Human Capital , https://ie.indeed.com/jobs?q=ios+developer&l=Dublin&start=80&vjk=70bde970eafaa98b
JavaScript Developer, Eolas Recruitment , https://ie.indeed.com/jobs?q=ios+developer&l=Dublin&start=80&vjk=0b8f2562f92dca16
Full Stack PHP Developer, Reperio Human Capital , https://ie.indeed.com/jobs?q=ios+developer&l=Dublin&start=80&vjk=f96d57dccfc6c195
Technical Digital Project Manager, RightFitie , https://ie.indeed.com/jobs?q=ios+developer&l=Dublin&start=80&vjk=f259233d513a3773
Full Stack Software Developer, Eolas Recruitment , https://ie.indeed.com/jobs?q=ios+developer&l=Dublin&start=80&vjk=4f8328e01d21aa2f
Technical Support Engineer  German speaker, Zendesk , https://ie.indeed.com/jobs?q=ios+developer&l=Dublin&start=90&vjk=30a44765cddfe1e1
Exciting New Front End Development Opportunity, Reperio Human Capital , https://ie.indeed.com/jobs?q=ios+developer&l=Dublin&start=90&vjk=92693fb2ba17be8b
Digital Technical Project Manager  Award winning agency, RightFitie , https://ie.indeed.com/jobs?q=ios+developer&l=Dublin&start=90&vjk=23652c158487236a
Mobile Test Engineer, Reperio Human Capital , https://ie.indeed.com/jobs?q=ios+developer&l=Dublin&start=90&vjk=542e51f13912025d
JavaScript Developer, Eolas Recruitment , https://ie.indeed.com/jobs?q=ios+developer&l=Dublin&start=90&vjk=0b8f2562f92dca16
Senior C Net Developer  Dublin CC Start Up, Reperio Human Capital , https://ie.indeed.com/jobs?q=ios+developer&l=Dublin&start=90&vjk=70bde970eafaa98b
UX Full Stack Designer, Hertz Europe , https://ie.indeed.com/jobs?q=ios+developer&l=Dublin&start=90&vjk=c97c762f678a583a
Full Stack PHP Developer, Reperio Human Capital , https://ie.indeed.com/jobs?q=ios+developer&l=Dublin&start=90&vjk=f96d57dccfc6c195
Technical Digital Project Manager, RightFitie , https://ie.indeed.com/jobs?q=ios+developer&l=Dublin&start=90&vjk=f259233d513a3773
Full Stack Software Developer, Eolas Recruitment , https://ie.indeed.com/jobs?q=ios+developer&l=Dublin&start=90&vjk=4f8328e01d21aa2f
