iOS Developer, Test Triange LTD , https://ie.indeed.com/jobs?q=ios+developer&l=Dublin&start=0&vjk=6874db0b587dabb5
Unity3D Developer, Black Onyx Interactive , https://ie.indeed.com/jobs?q=ios+developer&l=Dublin&start=0&vjk=a94f0bd40ea35854
Developer Emobility, Wipro LTD , https://ie.indeed.com/jobs?q=ios+developer&l=Dublin&start=0&vjk=ea80f1f59efbb969
iOS Developer, LetsGetChecked , https://ie.indeed.com/jobs?q=ios+developer&l=Dublin&start=0&vjk=574f7dc2d385d0e4
iOS App Developer, firecom , https://ie.indeed.com/jobs?q=ios+developer&l=Dublin&start=0&vjk=84c6c0edf0b58fea
Mobile Developer, Dublin City University , https://ie.indeed.com/jobs?q=ios+developer&l=Dublin&start=0&vjk=eb13f68a3e58e171
Solution Developer EMEA Dublin office, Zendesk , https://ie.indeed.com/jobs?q=ios+developer&l=Dublin&start=0&vjk=0fdb19eea474028b
iOS Developer, nineDots , https://ie.indeed.com/jobs?q=ios+developer&l=Dublin&start=0&vjk=62c14a4c4278777c
Software Developer, Zulleon , https://ie.indeed.com/jobs?q=ios+developer&l=Dublin&start=0&vjk=e4c6497852aa86ea
Software Developer C, Zulleon , https://ie.indeed.com/jobs?q=ios+developer&l=Dublin&start=0&vjk=0af1681233efda5c
UX Developer, Sportdec , https://ie.indeed.com/jobs?q=ios+developer&l=Dublin&start=10&vjk=fa960e2b4b7dfe84
Senior iOS Developer, HubSpot , https://ie.indeed.com/jobs?q=ios+developer&l=Dublin&start=10&vjk=f8509f3e2641ff6f
iOS Engineer Ireland, Arcblock Inc , https://ie.indeed.com/jobs?q=ios+developer&l=Dublin&start=10&vjk=1a2d7ab14d5a145d
Senior iOS Developer, Travelport , https://ie.indeed.com/jobs?q=ios+developer&l=Dublin&start=10&vjk=303041787fc8fa45
Senior Unity3D Developer, Zulleon , https://ie.indeed.com/jobs?q=ios+developer&l=Dublin&start=10&vjk=a3b312b379ef203f
Xamarin Developer  South Dublin, IT Search , https://ie.indeed.com/jobs?q=ios+developer&l=Dublin&start=10&vjk=8ba444d052a05429
Ruby on Rails Developer, Bizimply , https://ie.indeed.com/jobs?q=ios+developer&l=Dublin&start=10&vjk=54124bbcd3740d72
Mobile Application Developers, IMS MAXIMS , https://ie.indeed.com/jobs?q=ios+developer&l=Dublin&start=10&vjk=d87d39e84c27490e
Android Developer, LetsGetChecked , https://ie.indeed.com/jobs?q=ios+developer&l=Dublin&start=10&vjk=a90a5ca4168dcbf2
Systems Engineer, MacStadium , https://ie.indeed.com/jobs?q=ios+developer&l=Dublin&start=10&vjk=d393521c0e36274f
Senior Web Developer, TheJournalie , https://ie.indeed.com/jobs?q=ios+developer&l=Dublin&start=20&vjk=b73f79f907cd75f1
Software Engineer, BrowserStack , https://ie.indeed.com/jobs?q=ios+developer&l=Dublin&start=20&vjk=c13282830e2003cc
Senior iOS Developer, realTime , https://ie.indeed.com/jobs?q=ios+developer&l=Dublin&start=20&vjk=be26101ddc8dd015
Solution Developer EMEA Dublin office, Zendesk , https://ie.indeed.com/jobs?q=ios+developer&l=Dublin&start=20&vjk=0fdb19eea474028b
Xamarin Developer  South Dublin, IT Search , https://ie.indeed.com/jobs?q=ios+developer&l=Dublin&start=20&vjk=8ba444d052a05429
UIMobile Build and Release Engineer, Workday , https://ie.indeed.com/jobs?q=ios+developer&l=Dublin&start=20&vjk=793f8636347a9f0b
Senior Software Developer C, Zulleon , https://ie.indeed.com/jobs?q=ios+developer&l=Dublin&start=20&vjk=db7b0a0c02d1e3bf
Senior Game Client Engineer Unity, DIGIT Game Studios , https://ie.indeed.com/jobs?q=ios+developer&l=Dublin&start=20&vjk=bad601fc3834cc59
React Native Developer, Finsearch Professional Recruitment , https://ie.indeed.com/jobs?q=ios+developer&l=Dublin&start=20&vjk=0aa96fb68254c6cd
Developer Emobility, Wipro LTD , https://ie.indeed.com/jobs?q=ios+developer&l=Dublin&start=20&vjk=ea80f1f59efbb969
Software Architect, Travelport , https://ie.indeed.com/jobs?q=ios+developer&l=Dublin&start=30&vjk=8bb4d9870deab4d4
Senior Unity3D Developer, Zulleon , https://ie.indeed.com/jobs?q=ios+developer&l=Dublin&start=30&vjk=a3b312b379ef203f
Fullstack Software Engineer, Hertz Europe , https://ie.indeed.com/jobs?q=ios+developer&l=Dublin&start=30&vjk=51c2e951c17f48f9
Senior NET Developer, Flipdish , https://ie.indeed.com/jobs?q=ios+developer&l=Dublin&start=30&vjk=98003718a20c798f
Mobile Developer, Reperio Human Capital , https://ie.indeed.com/jobs?q=ios+developer&l=Dublin&start=30&vjk=4ef1c87e4686ed05
Senior Network Engineer, ServiceNow , https://ie.indeed.com/jobs?q=ios+developer&l=Dublin&start=30&vjk=e8f2aa90f75b1f0d
iOS Android Developer  Mobile Developer, Nicoll Curtin Limited , https://ie.indeed.com/jobs?q=ios+developer&l=Dublin&start=30&vjk=36d45ff749724ec5
Backend  Platform Engineer, Sportdec , https://ie.indeed.com/jobs?q=ios+developer&l=Dublin&start=30&vjk=71a0474b7d804023
Senior iOS Developer, Talentspot Recruitment , https://ie.indeed.com/jobs?q=ios+developer&l=Dublin&start=30&vjk=1c162f9191055c84
Software Engineering Manager  Mobile, Accela , https://ie.indeed.com/jobs?q=ios+developer&l=Dublin&start=30&vjk=5fea3b1712d2aa8c
Senior iOS Developer, Talentspot Recruitment , https://ie.indeed.com/jobs?q=ios+developer&l=Dublin&start=40&vjk=1c162f9191055c84
Software Engineering Manager  Mobile, Accela , https://ie.indeed.com/jobs?q=ios+developer&l=Dublin&start=40&vjk=5fea3b1712d2aa8c
Technical Support Engineer, Twilio , https://ie.indeed.com/jobs?q=ios+developer&l=Dublin&start=40&vjk=325b6660596b4b58
Junior UX Full Stack Designer, Hertz Europe , https://ie.indeed.com/jobs?q=ios+developer&l=Dublin&start=40&vjk=928dca03eb250d90
Senior Test Engineer, Independent News  Media , https://ie.indeed.com/jobs?q=ios+developer&l=Dublin&start=40&vjk=2fb831c277eabf1e
Cloud Support Engineer Developer and Mobile Services  AWS, AWS EMEA SARL Irish Branch , https://ie.indeed.com/jobs?q=ios+developer&l=Dublin&start=40&vjk=51bfe4c8406aac0b
Erasmus Web Developer, Stay Planet , https://ie.indeed.com/jobs?q=ios+developer&l=Dublin&start=40&vjk=4d7bb4d043322e4d
Support Engineer, Intercom , https://ie.indeed.com/jobs?q=ios+developer&l=Dublin&start=40&vjk=e8745ab765efbd68
CUnity Engineer, Zendesk , https://ie.indeed.com/jobs?q=ios+developer&l=Dublin&start=40&vjk=9b974fa5be082e5e
WebMobile Developer, Reperio Human Capital , https://ie.indeed.com/jobs?q=ios+developer&l=Dublin&start=40&vjk=f63b0715eab018d9
CUnity Engineer, Zendesk , https://ie.indeed.com/jobs?q=ios+developer&l=Dublin&start=50&vjk=9b974fa5be082e5e
UI Designer, LetsGetChecked , https://ie.indeed.com/jobs?q=ios+developer&l=Dublin&start=50&vjk=693d0431155bf860
UX Developer, Sportdec , https://ie.indeed.com/jobs?q=ios+developer&l=Dublin&start=50&vjk=fa960e2b4b7dfe84
The Dock  Scrum Master, Accenture , https://ie.indeed.com/jobs?q=ios+developer&l=Dublin&start=50&vjk=58bae6456c8fc4f1
Full Stack Developer, Reperio Human Capital , https://ie.indeed.com/jobs?q=ios+developer&l=Dublin&start=50&vjk=3722cfd56a6b5f95
Senior Engineer, Reperio Human Capital , https://ie.indeed.com/jobs?q=ios+developer&l=Dublin&start=50&vjk=fc7d1707659a3a5e
Java EE Developer, Ryanair , https://ie.indeed.com/jobs?q=ios+developer&l=Dublin&start=50&vjk=ce3137888f98ae13
Ruby on Rails Developer, Bizimply , https://ie.indeed.com/jobs?q=ios+developer&l=Dublin&start=50&vjk=54124bbcd3740d72
Backend Developer, Bamboo , https://ie.indeed.com/jobs?q=ios+developer&l=Dublin&start=50&vjk=738b86b8dbb8fa4c
Junior PHP Developer, Reperio Human Capital , https://ie.indeed.com/jobs?q=ios+developer&l=Dublin&start=50&vjk=7b3156b5ebf349ac
Senior Developer  FinTech StartUp  Dublin, Reperio Human Capital , https://ie.indeed.com/jobs?q=ios+developer&l=Dublin&start=60&vjk=042b5cbbcb3fc955
Senior Android Mobile Engineer, MasterCard , https://ie.indeed.com/jobs?q=ios+developer&l=Dublin&start=60&vjk=e7c8574c2979983e
Technical Support Engineer  German speaker, Zendesk , https://ie.indeed.com/jobs?q=ios+developer&l=Dublin&start=60&vjk=30a44765cddfe1e1
Exciting New Front End Development Opportunity, Reperio Human Capital , https://ie.indeed.com/jobs?q=ios+developer&l=Dublin&start=60&vjk=92693fb2ba17be8b
Digital Technical Project Manager  Award winning agency, RightFitie , https://ie.indeed.com/jobs?q=ios+developer&l=Dublin&start=60&vjk=23652c158487236a
Mobile Test Engineer, Reperio Human Capital , https://ie.indeed.com/jobs?q=ios+developer&l=Dublin&start=60&vjk=542e51f13912025d
JavaScript Developer, Eolas Recruitment , https://ie.indeed.com/jobs?q=ios+developer&l=Dublin&start=60&vjk=0b8f2562f92dca16
UX Full Stack Designer, Hertz Europe , https://ie.indeed.com/jobs?q=ios+developer&l=Dublin&start=60&vjk=c97c762f678a583a
Senior C Net Developer  Dublin CC Start Up, Reperio Human Capital , https://ie.indeed.com/jobs?q=ios+developer&l=Dublin&start=60&vjk=70bde970eafaa98b
Full Stack PHP Developer, Reperio Human Capital , https://ie.indeed.com/jobs?q=ios+developer&l=Dublin&start=60&vjk=f96d57dccfc6c195
Technical Digital Project Manager, RightFitie , https://ie.indeed.com/jobs?q=ios+developer&l=Dublin&start=70&vjk=f259233d513a3773
Full Stack Software Developer, Eolas Recruitment , https://ie.indeed.com/jobs?q=ios+developer&l=Dublin&start=70&vjk=4f8328e01d21aa2f
Technical Support Engineer  German speaker, Zendesk , https://ie.indeed.com/jobs?q=ios+developer&l=Dublin&start=80&vjk=30a44765cddfe1e1
Exciting New Front End Development Opportunity, Reperio Human Capital , https://ie.indeed.com/jobs?q=ios+developer&l=Dublin&start=80&vjk=92693fb2ba17be8b
Digital Technical Project Manager  Award winning agency, RightFitie , https://ie.indeed.com/jobs?q=ios+developer&l=Dublin&start=80&vjk=23652c158487236a
Mobile Test Engineer, Reperio Human Capital , https://ie.indeed.com/jobs?q=ios+developer&l=Dublin&start=80&vjk=542e51f13912025d
JavaScript Developer, Eolas Recruitment , https://ie.indeed.com/jobs?q=ios+developer&l=Dublin&start=80&vjk=0b8f2562f92dca16
UX Full Stack Designer, Hertz Europe , https://ie.indeed.com/jobs?q=ios+developer&l=Dublin&start=80&vjk=c97c762f678a583a
Senior C Net Developer  Dublin CC Start Up, Reperio Human Capital , https://ie.indeed.com/jobs?q=ios+developer&l=Dublin&start=80&vjk=70bde970eafaa98b
Full Stack PHP Developer, Reperio Human Capital , https://ie.indeed.com/jobs?q=ios+developer&l=Dublin&start=80&vjk=f96d57dccfc6c195
Technical Digital Project Manager, RightFitie , https://ie.indeed.com/jobs?q=ios+developer&l=Dublin&start=80&vjk=f259233d513a3773
Full Stack Software Developer, Eolas Recruitment , https://ie.indeed.com/jobs?q=ios+developer&l=Dublin&start=80&vjk=4f8328e01d21aa2f
Senior Android Mobile Engineer, MasterCard , https://ie.indeed.com/jobs?q=ios+developer&l=Dublin&start=90&vjk=e7c8574c2979983e
Exciting New Front End Development Opportunity, Reperio Human Capital , https://ie.indeed.com/jobs?q=ios+developer&l=Dublin&start=90&vjk=92693fb2ba17be8b
Digital Technical Project Manager  Award winning agency, RightFitie , https://ie.indeed.com/jobs?q=ios+developer&l=Dublin&start=90&vjk=23652c158487236a
Mobile Test Engineer, Reperio Human Capital , https://ie.indeed.com/jobs?q=ios+developer&l=Dublin&start=90&vjk=542e51f13912025d
UX Full Stack Designer, Hertz Europe , https://ie.indeed.com/jobs?q=ios+developer&l=Dublin&start=90&vjk=c97c762f678a583a
JavaScript Developer, Eolas Recruitment , https://ie.indeed.com/jobs?q=ios+developer&l=Dublin&start=90&vjk=0b8f2562f92dca16
Senior C Net Developer  Dublin CC Start Up, Reperio Human Capital , https://ie.indeed.com/jobs?q=ios+developer&l=Dublin&start=90&vjk=70bde970eafaa98b
Full Stack PHP Developer, Reperio Human Capital , https://ie.indeed.com/jobs?q=ios+developer&l=Dublin&start=90&vjk=f96d57dccfc6c195
Technical Digital Project Manager, RightFitie , https://ie.indeed.com/jobs?q=ios+developer&l=Dublin&start=90&vjk=f259233d513a3773
Full Stack Software Developer, Eolas Recruitment , https://ie.indeed.com/jobs?q=ios+developer&l=Dublin&start=90&vjk=4f8328e01d21aa2f
