C  Net Developer  Dublin, Prospect 33 , https://ie.indeed.com/jobs?q=.net+developer&l=Dublin&start=0&vjk=aea8d3a65b717b4a
Software Engineer C, Greenfinch Technology , https://ie.indeed.com/jobs?q=.net+developer&l=Dublin&start=0&vjk=9792f643aa91c9f6
C NET Developer, Software Design , https://ie.indeed.com/jobs?q=.net+developer&l=Dublin&start=0&vjk=f3f60ec3c252873a
Net Application Developer  Dublin, Citi , https://ie.indeed.com/jobs?q=.net+developer&l=Dublin&start=0&vjk=67ecc3641726a8c5
Net Developer, Ergo , https://ie.indeed.com/jobs?q=.net+developer&l=Dublin&start=0&vjk=5b25cd7e14e9421c
Net Developer  Public Sector, Ergo , https://ie.indeed.com/jobs?q=.net+developer&l=Dublin&start=0&vjk=a35d410153c02016
NET Developer, Avanade , https://ie.indeed.com/jobs?q=.net+developer&l=Dublin&start=0&vjk=acda954bad565afb
NET Developer C SQL Javascript HTML CSS Multithreadi, Ampers  Consulting , https://ie.indeed.com/jobs?q=.net+developer&l=Dublin&start=0&vjk=931b9a311277d2ce
Full Stack NET Software Developer, Hertz Europe , https://ie.indeed.com/jobs?q=.net+developer&l=Dublin&start=0&vjk=bd8166b2fac932a6
NET Software Developers, Exaxe , https://ie.indeed.com/jobs?q=.net+developer&l=Dublin&start=0&vjk=a20da4612db7d7fc
NET C Software Developer, Swappsi Software , https://ie.indeed.com/jobs?q=.net+developer&l=Dublin&start=10&vjk=c14632238724af9d
Software Developer, Eurofins , https://ie.indeed.com/jobs?q=.net+developer&l=Dublin&start=10&vjk=fc6bb567c8279701
Sr NET Developer, Propylon , https://ie.indeed.com/jobs?q=.net+developer&l=Dublin&start=10&vjk=541bcb54b5139584
NET Developer, Granite Digital , https://ie.indeed.com/jobs?q=.net+developer&l=Dublin&start=10&vjk=00ab2a75af6e59c1
Sr NET Developer, Propylon Ltd , https://ie.indeed.com/jobs?q=.net+developer&l=Dublin&start=10&vjk=870ca532d90cf7da
Junior NET Software Developer, BearingPoint UK , https://ie.indeed.com/jobs?q=.net+developer&l=Dublin&start=10&vjk=bcc8bc811e930739
Senior Web Developer  C NET, Fidelity Investments , https://ie.indeed.com/jobs?q=.net+developer&l=Dublin&start=10&vjk=aa70105988ee11d5
NET Developer, ChannelSight , https://ie.indeed.com/jobs?q=.net+developer&l=Dublin&start=10&vjk=d6979a0c1b7279b6
Developer, Fenergo , https://ie.indeed.com/jobs?q=.net+developer&l=Dublin&start=10&vjk=8db6316baf980ef5
Software Developer, Software Design , https://ie.indeed.com/jobs?q=.net+developer&l=Dublin&start=10&vjk=2347a1ee262c68a9
Microsoft NET Developer, Version 1 , https://ie.indeed.com/jobs?q=.net+developer&l=Dublin&start=20&vjk=7a64cf03eb853c23
UI Developer, Bank of America , https://ie.indeed.com/jobs?q=.net+developer&l=Dublin&start=20&vjk=ac86f33e236a2ed2
Net Developer, Ryanair , https://ie.indeed.com/jobs?q=.net+developer&l=Dublin&start=20&vjk=b63129be49142a33
NET Software Engineer, CorrIT Ltd , https://ie.indeed.com/jobs?q=.net+developer&l=Dublin&start=20&vjk=23005d913fbed914
NET developer  Dublin  AI company, Oliver James Associates , https://ie.indeed.com/jobs?q=.net+developer&l=Dublin&start=20&vjk=47c9c86fd9be3a75
Net Developer, EUROPEAN DYNAMICS , https://ie.indeed.com/jobs?q=.net+developer&l=Dublin&start=20&vjk=c45cff358a326bfc
Net Developer, Sabeo Contracting Services Ltd , https://ie.indeed.com/jobs?q=.net+developer&l=Dublin&start=20&vjk=efa4b5a902c6c97e
C Developer, Elm Solutions , https://ie.indeed.com/jobs?q=.net+developer&l=Dublin&start=20&vjk=989cb8c86086ad9b
Net Developer Dublin, USIT , https://ie.indeed.com/jobs?q=.net+developer&l=Dublin&start=20&vjk=a64f8b8d8af41c27
C Net Desktop Developer  Dublin and Madrid Positions, Ryanair , https://ie.indeed.com/jobs?q=.net+developer&l=Dublin&start=20&vjk=7a94ea30cfe7fb61
Process Automation Developer, UnitedHealth Group , https://ie.indeed.com/jobs?q=.net+developer&l=Dublin&start=30&vjk=488b8477d47a8949
Sr NET Developer, Propylon , https://ie.indeed.com/jobs?q=.net+developer&l=Dublin&start=30&vjk=541bcb54b5139584
NET Developer C SQL Javascript HTML CSS Multithreadi, Ampers  Consulting , https://ie.indeed.com/jobs?q=.net+developer&l=Dublin&start=30&vjk=931b9a311277d2ce
NET Contractor, GemPool , https://ie.indeed.com/jobs?q=.net+developer&l=Dublin&start=30&vjk=9d48bfdf1f717809
C NET Development Contract,  , https://ie.indeed.com/jobs?q=.net+developer&l=Dublin&start=30&vjk=af985d09fddf2e7d
Java Developer, Citi , https://ie.indeed.com/jobs?q=.net+developer&l=Dublin&start=30&vjk=93c86aee8ba4ecc9
C Net Developer  Dublin Centre, Reperio Human Capital , https://ie.indeed.com/jobs?q=.net+developer&l=Dublin&start=30&vjk=f5d8f1b06e9f539d
CRM Developer, Ergo , https://ie.indeed.com/jobs?q=.net+developer&l=Dublin&start=30&vjk=25544dec3d36793b
Software Engineer C, Greenfinch Technology , https://ie.indeed.com/jobs?q=.net+developer&l=Dublin&start=30&vjk=9792f643aa91c9f6
Software Developer, eDuce Software , https://ie.indeed.com/jobs?q=.net+developer&l=Dublin&start=30&vjk=624c53406747234b
Net developer Graduates Required  Permanent, Vantage Resources , https://ie.indeed.com/jobs?q=.net+developer&l=Dublin&start=40&vjk=d76bf4a903674b93
NET Backend Developer, Oneview Healthcare , https://ie.indeed.com/jobs?q=.net+developer&l=Dublin&start=40&vjk=58bfa445c44b8463
VBNet Developer  Permanent, Vantage Resources Ltd , https://ie.indeed.com/jobs?q=.net+developer&l=Dublin&start=40&vjk=832b634ef48300b1
Software Engineer Net, Verizon , https://ie.indeed.com/jobs?q=.net+developer&l=Dublin&start=40&vjk=bd14fdd39065e90d
Net Developer, Sigmar Recruitment , https://ie.indeed.com/jobs?q=.net+developer&l=Dublin&start=40&vjk=2ff68f413f93c7b3
Net Developer  Permanent, Vantage Resources Ltd , https://ie.indeed.com/jobs?q=.net+developer&l=Dublin&start=40&vjk=663be59941a64e73
CNet Developer, Eden Recruitment , https://ie.indeed.com/jobs?q=.net+developer&l=Dublin&start=40&vjk=77cc5ece9b69b307
Net Developer, Hays , https://ie.indeed.com/jobs?q=.net+developer&l=Dublin&start=40&vjk=9a6ee426568b9e11
Senior Software Developer, GameStop Limited , https://ie.indeed.com/jobs?q=.net+developer&l=Dublin&start=40&vjk=51f116a3bf5c8fae
Senior NET Developer, Flipdish , https://ie.indeed.com/jobs?q=.net+developer&l=Dublin&start=40&vjk=98003718a20c798f
Senior Software Developer, GameStop Limited , https://ie.indeed.com/jobs?q=.net+developer&l=Dublin&start=50&vjk=51f116a3bf5c8fae
Net developer Graduates Required  Permanent, Vantage Resources , https://ie.indeed.com/jobs?q=.net+developer&l=Dublin&start=50&vjk=d76bf4a903674b93
Hot Job VBNet Developer  Contract, Vantage Resources Ltd , https://ie.indeed.com/jobs?q=.net+developer&l=Dublin&start=50&vjk=bc12bc5f86cb3e01
Senior NET Developer, Flipdish , https://ie.indeed.com/jobs?q=.net+developer&l=Dublin&start=50&vjk=98003718a20c798f
Junior Email Marketing CoOrdinator, Web Summit , https://ie.indeed.com/jobs?q=.net+developer&l=Dublin&start=50&vjk=3cc5b8d7e7139a8b
Hot Job Net Developer  Contract, Vantage Resources Ltd , https://ie.indeed.com/jobs?q=.net+developer&l=Dublin&start=50&vjk=4b77498738affaf2
Build Engineer, Verizon , https://ie.indeed.com/jobs?q=.net+developer&l=Dublin&start=50&vjk=dbf719d7691bb654
Microsoft Dynamics CRM  DeveloperAnalyst, DAMCO , https://ie.indeed.com/jobs?q=.net+developer&l=Dublin&start=50&vjk=0eb89c70362c6193
Full Stack Engineer, Datahug , https://ie.indeed.com/jobs?q=.net+developer&l=Dublin&start=50&vjk=877a8f4757129ab8
Java Developer, Citi , https://ie.indeed.com/jobs?q=.net+developer&l=Dublin&start=50&vjk=93c86aee8ba4ecc9
Software Developer, Dovetail Human Resource Solutions , https://ie.indeed.com/jobs?q=.net+developer&l=Dublin&start=60&vjk=b3408336eac599ce
Microsoft SQL Development  Support, IPSUS , https://ie.indeed.com/jobs?q=.net+developer&l=Dublin&start=60&vjk=ac4895c62ec9475e
Full stack engineer, Fluke , https://ie.indeed.com/jobs?q=.net+developer&l=Dublin&start=60&vjk=50e10f7a378b06ba
Senior Net Developer, Ryanair , https://ie.indeed.com/jobs?q=.net+developer&l=Dublin&start=60&vjk=c6c3af9f82109367
Events Software Engineer, Web Summit , https://ie.indeed.com/jobs?q=.net+developer&l=Dublin&start=60&vjk=fc3621d38aed5eca
Application Support Net C, Enterprise Registry Solutions , https://ie.indeed.com/jobs?q=.net+developer&l=Dublin&start=60&vjk=65f4d7fedb66ae66
Software Developer, Morgan McKinley , https://ie.indeed.com/jobs?q=.net+developer&l=Dublin&start=60&vjk=61ead71e7f1d785d
NET Developer, GemPool , https://ie.indeed.com/jobs?q=.net+developer&l=Dublin&start=60&vjk=f2817fe0e6bdc116
SENIOR NET DEVELOPER, Progress Systems , https://ie.indeed.com/jobs?q=.net+developer&l=Dublin&start=60&vjk=c81feda6c7bda8a5
Process Automation Developer, UnitedHealth Group , https://ie.indeed.com/jobs?q=.net+developer&l=Dublin&start=60&vjk=488b8477d47a8949
Hot Job VBNet Developer  Contract, Vantage Resources Ltd , https://ie.indeed.com/jobs?q=.net+developer&l=Dublin&start=70&vjk=bc12bc5f86cb3e01
RPA Developer, Avanade , https://ie.indeed.com/jobs?q=.net+developer&l=Dublin&start=70&vjk=339e00566f69c773
Software Engineer  NET, LetsGetChecked , https://ie.indeed.com/jobs?q=.net+developer&l=Dublin&start=70&vjk=4efa5bfe2db7cb57
Mobile Architect, Verizon , https://ie.indeed.com/jobs?q=.net+developer&l=Dublin&start=70&vjk=080927d77124641d
Penetration Tester, Micro Focus , https://ie.indeed.com/jobs?q=.net+developer&l=Dublin&start=70&vjk=5625d099e8c1cc67
Hot Job Net Developer  Contract, Vantage Resources Ltd , https://ie.indeed.com/jobs?q=.net+developer&l=Dublin&start=70&vjk=4b77498738affaf2
Senior Net Web Developer, Verizon , https://ie.indeed.com/jobs?q=.net+developer&l=Dublin&start=70&vjk=0688565c49e44880
Software Engineer  Cloud ES, Microsoft , https://ie.indeed.com/jobs?q=.net+developer&l=Dublin&start=70&vjk=6d4e05f7e584159d
Net FullStack Developer in Dublin city centre, Harvey Nash Ireland , https://ie.indeed.com/jobs?q=.net+developer&l=Dublin&start=70&vjk=80eed4c1a1fed990
Technical Lead, Eurofins Ireland IT Solutions , https://ie.indeed.com/jobs?q=.net+developer&l=Dublin&start=70&vjk=5b4197a0cb4bd25a
Net FullStack Developer in Dublin city centre, Harvey Nash Ireland , https://ie.indeed.com/jobs?q=.net+developer&l=Dublin&start=80&vjk=80eed4c1a1fed990
Ruby Engineer  Product, Web Summit , https://ie.indeed.com/jobs?q=.net+developer&l=Dublin&start=80&vjk=83c5e07e9a42786d
Technical Analyst  Docker, NTT DATA Services , https://ie.indeed.com/jobs?q=.net+developer&l=Dublin&start=80&vjk=b46326267012c31b
MicroServices NET Core Developer, Archer , https://ie.indeed.com/jobs?q=.net+developer&l=Dublin&start=80&vjk=c8668767d38f2cf9
Net Developer in Dublin City Centre, Harvey Nash Ireland , https://ie.indeed.com/jobs?q=.net+developer&l=Dublin&start=80&vjk=1ddae5d1acf7adaf
VBNet Developer  Contract, Vantage Resources , https://ie.indeed.com/jobs?q=.net+developer&l=Dublin&start=80&vjk=10c0c00162d30ade
MidLevel C Net Software Developer, Reperio Human Capital , https://ie.indeed.com/jobs?q=.net+developer&l=Dublin&start=80&vjk=26169295b56ac52d
C NET Development Contract,  , https://ie.indeed.com/jobs?q=.net+developer&l=Dublin&start=80&vjk=af985d09fddf2e7d
NET Developers  Fast Growing Tech  North Dublin, Oliver James Associates , https://ie.indeed.com/jobs?q=.net+developer&l=Dublin&start=80&vjk=ee14b666542d85c9
MidLevel Developers  Learn New Tech, Archer , https://ie.indeed.com/jobs?q=.net+developer&l=Dublin&start=80&vjk=845d7c36770b22c8
C NET Development Contract,  , https://ie.indeed.com/jobs?q=.net+developer&l=Dublin&start=90&vjk=af985d09fddf2e7d
C Net Software Developer  Dublin CC, Reperio Human Capital , https://ie.indeed.com/jobs?q=.net+developer&l=Dublin&start=90&vjk=8d308339fa47ff42
ReactJS Developer  South Dublin, Oliver James Associates , https://ie.indeed.com/jobs?q=.net+developer&l=Dublin&start=90&vjk=0a660a7b69453088
Software Engineer C, Recruiters , https://ie.indeed.com/jobs?q=.net+developer&l=Dublin&start=90&vjk=fbed07df5ff70a76
Microsoft Dynamics NAV  Dynamics 365 Business Central Devel, Datapac , https://ie.indeed.com/jobs?q=.net+developer&l=Dublin&start=90&vjk=adcd895aed3ba116
C Net Software Developer  Dublin, Reperio Human Capital , https://ie.indeed.com/jobs?q=.net+developer&l=Dublin&start=90&vjk=afb756065c7f72a4
NET Contractor, GemPool , https://ie.indeed.com/jobs?q=.net+developer&l=Dublin&start=90&vjk=9d48bfdf1f717809
Systems Software Developer, Morgan McKinley , https://ie.indeed.com/jobs?q=.net+developer&l=Dublin&start=90&vjk=f12f90ebbb133dac
Cloud Support Engineer Developer and Mobile Services  AWS, AWS EMEA SARL Irish Branch , https://ie.indeed.com/jobs?q=.net+developer&l=Dublin&start=90&vjk=51bfe4c8406aac0b
Mid Level Net Software Developer, Morgan McKinley , https://ie.indeed.com/jobs?q=.net+developer&l=Dublin&start=90&vjk=63187fefe2484ddf
