IT Systems Administrator, Ergo , https://ie.indeed.com/jobs?q=system administrator&l=Dublin&start=0&vjk=4ddfc43a0be66831
System Administrator  Windows Active Directory, IPSUS , https://ie.indeed.com/jobs?q=system administrator&l=Dublin&start=0&vjk=0f932971b06183d7
Systems Administrator, ICT Services , https://ie.indeed.com/jobs?q=system administrator&l=Dublin&start=0&vjk=b8675b91e825abec
Junior Systems Administrator, Corvil , https://ie.indeed.com/jobs?q=system administrator&l=Dublin&start=0&vjk=6013ab13eb32afce
System Administrator, IT Alliance Group , https://ie.indeed.com/jobs?q=system administrator&l=Dublin&start=0&vjk=ecc2b9b9a85af741
Windows System Administrator, Bank of America , https://ie.indeed.com/jobs?q=system administrator&l=Dublin&start=0&vjk=ee6b5883eb45eb4a
Systems Administrator, Realex Payments , https://ie.indeed.com/jobs?q=system administrator&l=Dublin&start=0&vjk=112ac422fdee61ea
IT Systems Administrator  Contract 6 Months, IPSUS , https://ie.indeed.com/jobs?q=system administrator&l=Dublin&start=0&vjk=f5a7cdadb8b53d3a
Digital Systems Administrator, Independent News  Media , https://ie.indeed.com/jobs?q=system administrator&l=Dublin&start=0&vjk=46d380246407390c
Level 1 IT Helpdesk Support Administrator, Ergo , https://ie.indeed.com/jobs?q=system administrator&l=Dublin&start=0&vjk=146d9099e3fa4cc6
Systems Administrator, PFH Technology Group , https://ie.indeed.com/jobs?q=system administrator&l=Dublin&start=10&vjk=0777875a4c631bc2
System Administrator, GCS Recruitment Ireland , https://ie.indeed.com/jobs?q=system administrator&l=Dublin&start=10&vjk=8e118c63504b07db
Systems Administrator, Eden Recruitment , https://ie.indeed.com/jobs?q=system administrator&l=Dublin&start=10&vjk=c8cfb5c91f9e0657
Systems Administrator, Shire Pharmaceuticals , https://ie.indeed.com/jobs?q=system administrator&l=Dublin&start=10&vjk=4c3ca3c1cd790dce
System Administrator, Experis UK  Ireland , https://ie.indeed.com/jobs?q=system administrator&l=Dublin&start=10&vjk=f42ac2cbc442b8e3
Client Billing System Administrator Officer, State Street , https://ie.indeed.com/jobs?q=system administrator&l=Dublin&start=10&vjk=df056162fb298993
Junior Systems Administrator, City Wonders , https://ie.indeed.com/jobs?q=system administrator&l=Dublin&start=10&vjk=529d077210ae6872
Systems Administrator Dublin, Charles River Development , https://ie.indeed.com/jobs?q=system administrator&l=Dublin&start=10&vjk=2ef4b55821f192ab
IT Helpdesk, Hacketts , https://ie.indeed.com/jobs?q=system administrator&l=Dublin&start=10&vjk=2089ed7c69a0c743
IT Systems Administrator, Reperio Human Capital , https://ie.indeed.com/jobs?q=system administrator&l=Dublin&start=10&vjk=449dc7664c8efdaa
IT Systems Administrator, Reperio Human Capital , https://ie.indeed.com/jobs?q=system administrator&l=Dublin&start=20&vjk=449dc7664c8efdaa
IT Systems Administrator 2year Fixed Term Contract, Vantage Resources Ltd , https://ie.indeed.com/jobs?q=system administrator&l=Dublin&start=20&vjk=c2905c0d976afed6
Linux System Administrator, ITech Consult , https://ie.indeed.com/jobs?q=system administrator&l=Dublin&start=20&vjk=655a3b71203b4d0c
IT Systems Administrator  Windows Immediate, Reperio Human Capital , https://ie.indeed.com/jobs?q=system administrator&l=Dublin&start=20&vjk=aae823434c07a531
Linux Systems Administrator, JC Associates Ltd , https://ie.indeed.com/jobs?q=system administrator&l=Dublin&start=20&vjk=f3673e11f121f571
MES System Administrator, Zenith Technologies , https://ie.indeed.com/jobs?q=system administrator&l=Dublin&start=20&vjk=ac78631e09a92566
Wintel System Administrator, Ryanair , https://ie.indeed.com/jobs?q=system administrator&l=Dublin&start=20&vjk=cf4e083f67522583
Logistics Administrator, Data Solutions , https://ie.indeed.com/jobs?q=system administrator&l=Dublin&start=20&vjk=9d7dffdec9355915
Safety Administrator, Calor , https://ie.indeed.com/jobs?q=system administrator&l=Dublin&start=20&vjk=fd8ab492c8400ae9
System Administrator, Monsoon Consulting , https://ie.indeed.com/jobs?q=system administrator&l=Dublin&start=20&vjk=9faa7e07cbbb876c
Junior Office Administrator  Rathcoole County Dublin, Alliance Ireland , https://ie.indeed.com/jobs?q=system administrator&l=Dublin&start=30&vjk=6018c65679ed075c
IT Systems Administrator, Hays , https://ie.indeed.com/jobs?q=system administrator&l=Dublin&start=30&vjk=f867514812349490
Systems Administrator  Security  Networks, Reperio Human Capital , https://ie.indeed.com/jobs?q=system administrator&l=Dublin&start=30&vjk=7cd1999c5a226bfb
Systems Administrator  Dublin CC, Reperio Human Capital , https://ie.indeed.com/jobs?q=system administrator&l=Dublin&start=30&vjk=70c86bf7e0f1831e
System Administrator SCCM  Dublin City Centre, IT Alliance Group , https://ie.indeed.com/jobs?q=system administrator&l=Dublin&start=30&vjk=a1028071a43ef28e
Assistant Systems Administrator, DNG , https://ie.indeed.com/jobs?q=system administrator&l=Dublin&start=30&vjk=a0ce742c0f9ca297
Linux Systems Administrator, Eden Recruitment , https://ie.indeed.com/jobs?q=system administrator&l=Dublin&start=30&vjk=bd4531b14273cf16
Test Centre Invigilator  Dun Laoghaire Parttime, Prometric , https://ie.indeed.com/jobs?q=system administrator&l=Dublin&start=30&vjk=931d409afa9cda1f
Systems Administrator, Reperio Human Capital , https://ie.indeed.com/jobs?q=system administrator&l=Dublin&start=30&vjk=0a56ac1d66ef8b4e
Senior Systems Administrator, j2 Cloud Services , https://ie.indeed.com/jobs?q=system administrator&l=Dublin&start=30&vjk=30232985f5dce106
IT Support Analyst, Accenture , https://ie.indeed.com/jobs?q=system administrator&l=Dublin&start=40&vjk=4bdac4943a36a2f8
Sales Support Administrator, Walls to Workstations Ltd , https://ie.indeed.com/jobs?q=system administrator&l=Dublin&start=40&vjk=9f5fb5cf82ad544c
Systems Admin with Networking, IE Domain Registry CLG , https://ie.indeed.com/jobs?q=system administrator&l=Dublin&start=40&vjk=f8cee52e0bd88f02
Data Administrator, Actavo , https://ie.indeed.com/jobs?q=system administrator&l=Dublin&start=40&vjk=1c15c099907458a9
Windows Systems Administrator  Contract, Reperio Human Capital , https://ie.indeed.com/jobs?q=system administrator&l=Dublin&start=40&vjk=31b0e2e2e20979f2
Unix Systems Administrator, Experis UK  Ireland , https://ie.indeed.com/jobs?q=system administrator&l=Dublin&start=40&vjk=01bcf30d105ca99b
Sales Administration, Dog Day Design , https://ie.indeed.com/jobs?q=system administrator&l=Dublin&start=40&vjk=1ddeaf6b2d5de2be
Junior System Administrator, GCS Recruitment Ireland , https://ie.indeed.com/jobs?q=system administrator&l=Dublin&start=40&vjk=d8d72926064c9803
Accounts Payable Administrator, Ryanair , https://ie.indeed.com/jobs?q=system administrator&l=Dublin&start=40&vjk=a44f7929c5c81dc9
IT Helpdesk Administrator, Link Personnel Services , https://ie.indeed.com/jobs?q=system administrator&l=Dublin&start=40&vjk=c81a9c426e8f2a33
Foreign Settlements Administrator, Davy , https://ie.indeed.com/jobs?q=system administrator&l=Dublin&start=50&vjk=2e99d44f7cc0b6cc
 Personal Shopping AdministratorAssistant PartTime, Arnotts , https://ie.indeed.com/jobs?q=system administrator&l=Dublin&start=50&vjk=2e8ea34753454015
Linux Systems Engineer  Administrator, IPSUS , https://ie.indeed.com/jobs?q=system administrator&l=Dublin&start=50&vjk=eceae9ae0381e20f
IT Support Technician II, Jabil Circuit , https://ie.indeed.com/jobs?q=system administrator&l=Dublin&start=50&vjk=ff89f7c4a9133dd7
Systems Administrator South Dublin, realTime , https://ie.indeed.com/jobs?q=system administrator&l=Dublin&start=50&vjk=fe9e59f1747fa816
Network Administrator College Park Dublin Ireland, Mallinckrodt , https://ie.indeed.com/jobs?q=system administrator&l=Dublin&start=50&vjk=8a9b73b016b27dda
Inventory Administrator, CPL Recruitment , https://ie.indeed.com/jobs?q=system administrator&l=Dublin&start=50&vjk=c7b0e40bc31b2b0e
Systems and IT Administrator, Hays , https://ie.indeed.com/jobs?q=system administrator&l=Dublin&start=50&vjk=740f40298c26fae3
Sharepoint  Data Administrator, Walls Construction , https://ie.indeed.com/jobs?q=system administrator&l=Dublin&start=50&vjk=b3c5d20e601c2a92
IST Administrator, Savills , https://ie.indeed.com/jobs?q=system administrator&l=Dublin&start=50&vjk=0fa6ad9f09c84ae2
Systems Administrator South Dublin, realTime , https://ie.indeed.com/jobs?q=system administrator&l=Dublin&start=60&vjk=fe9e59f1747fa816
Data Administrator, Smartbox Group , https://ie.indeed.com/jobs?q=system administrator&l=Dublin&start=60&vjk=ddfb7ccf7407b5ac
AdministratorReceptionist, Spectrum 10X , https://ie.indeed.com/jobs?q=system administrator&l=Dublin&start=60&vjk=cb8559b4b89951ef
Administrator, Grant Thornton , https://ie.indeed.com/jobs?q=system administrator&l=Dublin&start=60&vjk=90bbe908078dd8f5
Systems and IT Administrator, Hays , https://ie.indeed.com/jobs?q=system administrator&l=Dublin&start=60&vjk=740f40298c26fae3
HR Administrator  9 Month FTC, Deloitte , https://ie.indeed.com/jobs?q=system administrator&l=Dublin&start=60&vjk=90fceaad85dff589
Business Support Administrator, Shannon Management Services Ltd , https://ie.indeed.com/jobs?q=system administrator&l=Dublin&start=60&vjk=e5366d820efa13e7
Junior Office Admin, Vero Coffee Company , https://ie.indeed.com/jobs?q=system administrator&l=Dublin&start=60&vjk=b3ea989bd479f461
Junior System Administrator, Brightwater , https://ie.indeed.com/jobs?q=system administrator&l=Dublin&start=60&vjk=e8e1192824dd3f5a
Project Developer Graduate or Experienced, SAS INTERNATIONAL LTD , https://ie.indeed.com/jobs?q=system administrator&l=Dublin&start=60&vjk=e215c8d57257ab58
Office 365 Administrator, Actavo , https://ie.indeed.com/jobs?q=system administrator&l=Dublin&start=70&vjk=db4026c4835609be
HR Assistant, Maples and Calder , https://ie.indeed.com/jobs?q=system administrator&l=Dublin&start=70&vjk=4aabbdb3b277f104
Risk Oversight Officer  Luxembourg Branch, Davy , https://ie.indeed.com/jobs?q=system administrator&l=Dublin&start=70&vjk=c32b00881e819722
Data Administrator  Invoicing Data Management, Smartbox Group , https://ie.indeed.com/jobs?q=system administrator&l=Dublin&start=70&vjk=e02ee7fe310a886a
Site AdministratorDocument Controller, Glenform Structures Limited , https://ie.indeed.com/jobs?q=system administrator&l=Dublin&start=70&vjk=5ca15f0bbea96fd7
RMA Administrator, Fitbit , https://ie.indeed.com/jobs?q=system administrator&l=Dublin&start=70&vjk=d6401268a3b37ce6
Technical Analyst, Deloitte , https://ie.indeed.com/jobs?q=system administrator&l=Dublin&start=70&vjk=095ad9cfaf65c0ce
Claims Administrator, AXA , https://ie.indeed.com/jobs?q=system administrator&l=Dublin&start=70&vjk=deb799187576be76
Claims Administrator, AXA General Insurance , https://ie.indeed.com/jobs?q=system administrator&l=Dublin&start=70&vjk=a9273e49ce34062b
Ediscovery  IT Forensics Consultant, Grant Thornton , https://ie.indeed.com/jobs?q=system administrator&l=Dublin&start=70&vjk=b110b63735146521
Service Administrator, Orona Ireland , https://ie.indeed.com/jobs?q=system administrator&l=Dublin&start=80&vjk=9b1f78535cf6fe6f
Accounts and Office Administrator, Shimmer Research Ltd , https://ie.indeed.com/jobs?q=system administrator&l=Dublin&start=80&vjk=35a281893bd1df88
Jnr IT Systems Administrator Dublin 2, Firstaff , https://ie.indeed.com/jobs?q=system administrator&l=Dublin&start=80&vjk=efa4272bb4e1438a
Administrator Long term Temporary, Hall Recruitment , https://ie.indeed.com/jobs?q=system administrator&l=Dublin&start=80&vjk=c8c57f43e3ae4bcb
Office Administrator, Wholefoods Wholsale Limited , https://ie.indeed.com/jobs?q=system administrator&l=Dublin&start=80&vjk=0d5e152c2f193cd2
HR and Payroll Officer, Concern Worldwide , https://ie.indeed.com/jobs?q=system administrator&l=Dublin&start=80&vjk=160d8285e2737fae
Systems Engineer Systems Administrator, Sabeo Contracting Services Ltd , https://ie.indeed.com/jobs?q=system administrator&l=Dublin&start=80&vjk=42de900d135c9ae9
Logistics Administrator, CPL Recruitment , https://ie.indeed.com/jobs?q=system administrator&l=Dublin&start=80&vjk=e2ea8f92309cfa0a
Flight Operations  Finance Administrator, Ryanair , https://ie.indeed.com/jobs?q=system administrator&l=Dublin&start=80&vjk=c5990f11f2ae12b4
Office Administrator, Site Passport , https://ie.indeed.com/jobs?q=system administrator&l=Dublin&start=80&vjk=2e266b3eff5225df
Financial Services Administrator, Mortgagesie , https://ie.indeed.com/jobs?q=system administrator&l=Dublin&start=90&vjk=f8bdc2683370a2d6
Junior Administrator  Advisory  Restructuring, PKF OConnor Leddy  Holmes , https://ie.indeed.com/jobs?q=system administrator&l=Dublin&start=90&vjk=32fefe5ffcc62091
Administrator Immediate Start  Finglas 1214ph, CPL Recruitment , https://ie.indeed.com/jobs?q=system administrator&l=Dublin&start=90&vjk=8a154acee5d731be
Systems Administrator Network Engineer, Pivotal Software , https://ie.indeed.com/jobs?q=system administrator&l=Dublin&start=90&vjk=fb1025b8034e7284
Graduate Administrator  Dublin 3, Osborne , https://ie.indeed.com/jobs?q=system administrator&l=Dublin&start=90&vjk=77815e59f6999587
AMLKYC Administrator, First Data , https://ie.indeed.com/jobs?q=system administrator&l=Dublin&start=90&vjk=634a08ba7fbdf795
Engineer  Scenario Planning, EirGrid Group , https://ie.indeed.com/jobs?q=system administrator&l=Dublin&start=90&vjk=6b8f85a3583bcbfe
New Business Administrator  Pensions, DST Systems , https://ie.indeed.com/jobs?q=system administrator&l=Dublin&start=90&vjk=d9816af6417d854f
Administrator  City Centre  Immediate Start  33k, CPL Recruitment , https://ie.indeed.com/jobs?q=system administrator&l=Dublin&start=90&vjk=efec3a0899acb932
Corporate Secretarial Administrator, BDO , https://ie.indeed.com/jobs?q=system administrator&l=Dublin&start=90&vjk=e7df5998607e9250
