Web Designer  Wordpress Developer, Evolution Digital , https://ie.indeed.com/jobs?q=web+developer&l=Dublin&start=0&vjk=95950705cc27731c
Freelance Web Software Tester, Interactive Services , https://ie.indeed.com/jobs?q=web+developer&l=Dublin&start=0&vjk=04927b4e74e63ae3
Web Developer, Software Design , https://ie.indeed.com/jobs?q=web+developer&l=Dublin&start=0&vjk=1cb1c51864fbf695
Web Developer, HubSpot , https://ie.indeed.com/jobs?q=web+developer&l=Dublin&start=0&vjk=eb7913c666141e44
Web Developer, IPSUS , https://ie.indeed.com/jobs?q=web+developer&l=Dublin&start=0&vjk=d7dafa784e0c02b1
Frontend Engineer Ireland, Arcblock Inc , https://ie.indeed.com/jobs?q=web+developer&l=Dublin&start=0&vjk=635d4fadc0b5389e
Frontend Engineer, Workday , https://ie.indeed.com/jobs?q=web+developer&l=Dublin&start=0&vjk=37ac57af7855bc2f
JavaScriptFrontend Engineer, Workday , https://ie.indeed.com/jobs?q=web+developer&l=Dublin&start=0&vjk=2aeaca77f38470f2
Software Developer Graduate  Dublin Ireland, Guidewire Software Inc , https://ie.indeed.com/jobs?q=web+developer&l=Dublin&start=0&vjk=f591cbc8b3877015
Web Developer, Chill Insurance , https://ie.indeed.com/jobs?q=web+developer&l=Dublin&start=0&vjk=d19384600b1b0bb9
Software Engineering or Site Reliability Engineering Intern, Google , https://ie.indeed.com/jobs?q=web+developer&l=Dublin&start=10&vjk=6193ada8624f82fb
Software Engineer  Web Applications, Truata , https://ie.indeed.com/jobs?q=web+developer&l=Dublin&start=10&vjk=110a4999c0b13469
Software Developer  Intern, Groupon , https://ie.indeed.com/jobs?q=web+developer&l=Dublin&start=10&vjk=760b43367b189551
Front End Engineer, Sylon , https://ie.indeed.com/jobs?q=web+developer&l=Dublin&start=10&vjk=7b4d82de4c8cd6ff
Summer 2019 Intern Software Developer, Salesforce , https://ie.indeed.com/jobs?q=web+developer&l=Dublin&start=10&vjk=51b8984fb507945b
Junior IT Support Engineer, Positive Equity , https://ie.indeed.com/jobs?q=web+developer&l=Dublin&start=10&vjk=fc0049cbe4d2fd0e
Front End Developer Dublin, TicketGuardian , https://ie.indeed.com/jobs?q=web+developer&l=Dublin&start=10&vjk=697ac57f348c7e3d
Frontend Software Engineer React  Dublin Ireland, Telnyx , https://ie.indeed.com/jobs?q=web+developer&l=Dublin&start=10&vjk=e24f77d0218d08c8
Frontend Developer React  Dublin Ireland, Telnyx , https://ie.indeed.com/jobs?q=web+developer&l=Dublin&start=10&vjk=c4aee0045814f222
FrontEnd Developer, Natero , https://ie.indeed.com/jobs?q=web+developer&l=Dublin&start=10&vjk=78a6c1c93171f031
Mobile Application Developers, IMS MAXIMS , https://ie.indeed.com/jobs?q=web+developer&l=Dublin&start=20&vjk=d87d39e84c27490e
Frontend Developer, Fluke , https://ie.indeed.com/jobs?q=web+developer&l=Dublin&start=20&vjk=8b29c520a428a18f
FrontEnd Developer, Kylin Prime Group , https://ie.indeed.com/jobs?q=web+developer&l=Dublin&start=20&vjk=3d117962652aa4e0
UI Developer, Bank of America , https://ie.indeed.com/jobs?q=web+developer&l=Dublin&start=20&vjk=ac86f33e236a2ed2
Software Developer, Dataships , https://ie.indeed.com/jobs?q=web+developer&l=Dublin&start=20&vjk=cd70ba276a7e4e41
Web FrontEnd Developer, Greenfinch , https://ie.indeed.com/jobs?q=web+developer&l=Dublin&start=20&vjk=a173dc3c6cbc717a
Junior Email Marketing CoOrdinator,  , https://ie.indeed.com/jobs?q=web+developer&l=Dublin&start=20&vjk=3cc5b8d7e7139a8b
Software Developer, Eurofins , https://ie.indeed.com/jobs?q=web+developer&l=Dublin&start=20&vjk=fc6bb567c8279701
The Dock  Junior Front End Engineer, Accenture , https://ie.indeed.com/jobs?q=web+developer&l=Dublin&start=20&vjk=c6b1107c4e0dd742
BACKENDGO DEVELOPER, 42 CRUNCH , https://ie.indeed.com/jobs?q=web+developer&l=Dublin&start=20&vjk=d043ca2705b7d2bf
Front End Developer, SoftwareONE , https://ie.indeed.com/jobs?q=web+developer&l=Dublin&start=30&vjk=e55c35087deb1bfa
Developer, Intercontinental Exchange , https://ie.indeed.com/jobs?q=web+developer&l=Dublin&start=30&vjk=c910a2c462bc67fd
Software Development Intern, FINEOS Corporation , https://ie.indeed.com/jobs?q=web+developer&l=Dublin&start=30&vjk=b7cde7d4420fcd1b
Frontend Software Developer, RTÉ , https://ie.indeed.com/jobs?q=web+developer&l=Dublin&start=30&vjk=58c5482112404413
Frontend Developer and Designer, MedMedia Group , https://ie.indeed.com/jobs?q=web+developer&l=Dublin&start=30&vjk=f7c87ccc14425533
Full Stack Web Developer, FBD Holdings plc , https://ie.indeed.com/jobs?q=web+developer&l=Dublin&start=30&vjk=193a11dfcab3dba7
Software Developer, Software Design , https://ie.indeed.com/jobs?q=web+developer&l=Dublin&start=30&vjk=2347a1ee262c68a9
Web Development Engineer  CloudWatch, Amazon Data Srvcs Ireland Ltd , https://ie.indeed.com/jobs?q=web+developer&l=Dublin&start=30&vjk=3a6c263a2102b4c5
Front End Engineer  Load Balancing Console, Amazon Data Srvcs Ireland Ltd , https://ie.indeed.com/jobs?q=web+developer&l=Dublin&start=30&vjk=f17f94c1eb93e3eb
UI Developer, DemonWare , https://ie.indeed.com/jobs?q=web+developer&l=Dublin&start=30&vjk=9822df96dcfd7da1
UI Developer, Activision , https://ie.indeed.com/jobs?q=web+developer&l=Dublin&start=40&vjk=c78edead625013a5
Software Engineering Intern PhD 2019, Google , https://ie.indeed.com/jobs?q=web+developer&l=Dublin&start=40&vjk=e13a6b59ea307cea
Principal Full Stack Web Developer, siren , https://ie.indeed.com/jobs?q=web+developer&l=Dublin&start=40&vjk=c15be6e75b4e98e8
Front End Developer, Shipyard Technology Ventures , https://ie.indeed.com/jobs?q=web+developer&l=Dublin&start=40&vjk=8648b671bc2a82f4
Software Developer, airG , https://ie.indeed.com/jobs?q=web+developer&l=Dublin&start=40&vjk=5feabe1247ff1d4b
Frontend Developer, Insight HR , https://ie.indeed.com/jobs?q=web+developer&l=Dublin&start=40&vjk=038c9a1f74950bfd
Senior Java  JavaScript developers remote job, Alto Analytics SL , https://ie.indeed.com/jobs?q=web+developer&l=Dublin&start=40&vjk=72e280c2a9eb0725
Developer, Fenergo , https://ie.indeed.com/jobs?q=web+developer&l=Dublin&start=40&vjk=8db6316baf980ef5
Erasmus Web Developer, Stay Planet , https://ie.indeed.com/jobs?q=web+developer&l=Dublin&start=40&vjk=4d7bb4d043322e4d
Full Stack Backend  Frontend developer, Cortex Cognition , https://ie.indeed.com/jobs?q=web+developer&l=Dublin&start=40&vjk=6dbffad5115181dc
Software Engineer, BrowserStack , https://ie.indeed.com/jobs?q=web+developer&l=Dublin&start=50&vjk=c13282830e2003cc
Fullstack Software Engineer, SoapBox Labs , https://ie.indeed.com/jobs?q=web+developer&l=Dublin&start=50&vjk=df790c252edbb014
Website Merchandiser  Dundalk, National Pen , https://ie.indeed.com/jobs?q=web+developer&l=Dublin&start=50&vjk=00f1c04d7ac41af7
Software Engineer Back end  Dublin Ireland, Jet  The Walmart eCommerce Family of Brands , https://ie.indeed.com/jobs?q=web+developer&l=Dublin&start=50&vjk=9c95a0dd7c3e0160
Full Stack Backend  Frontend developer, Cortex Cognition , https://ie.indeed.com/jobs?q=web+developer&l=Dublin&start=50&vjk=6dbffad5115181dc
Java  C Software Engineers, Greenfinch , https://ie.indeed.com/jobs?q=web+developer&l=Dublin&start=50&vjk=59afe389af54bdab
BACKENDFRONTEND FULL STACK DEVELOPER, Cortex Cognition , https://ie.indeed.com/jobs?q=web+developer&l=Dublin&start=50&vjk=295b355763c54edd
Senior Java  JavaScript developers remote job, Alto Analytics SL , https://ie.indeed.com/jobs?q=web+developer&l=Dublin&start=50&vjk=72e280c2a9eb0725
Software Developer, eDuce Software , https://ie.indeed.com/jobs?q=web+developer&l=Dublin&start=50&vjk=624c53406747234b
Junior Backend Developer PHP Laravel, MoGi Group , https://ie.indeed.com/jobs?q=web+developer&l=Dublin&start=50&vjk=b8212f249cbec43c
FRONTEND DEVELOPER, SONALAKE , https://ie.indeed.com/jobs?q=web+developer&l=Dublin&start=60&vjk=392ed4a793a8fbf8
Software Developer, eDuce Software , https://ie.indeed.com/jobs?q=web+developer&l=Dublin&start=60&vjk=624c53406747234b
Web Developer, VIP Recruitment , https://ie.indeed.com/jobs?q=web+developer&l=Dublin&start=60&vjk=f40367706bb4ad62
UI  UX Web Designer, Together Digital , https://ie.indeed.com/jobs?q=web+developer&l=Dublin&start=60&vjk=b20427895a44591d
Full Stack Developer, Dublin City University , https://ie.indeed.com/jobs?q=web+developer&l=Dublin&start=60&vjk=6196e7ee617562aa
Android Developer, EDG Software Factory , https://ie.indeed.com/jobs?q=web+developer&l=Dublin&start=60&vjk=7e826ffae992e219
React Native Developer, Finsearch Professional Recruitment , https://ie.indeed.com/jobs?q=web+developer&l=Dublin&start=60&vjk=0aa96fb68254c6cd
Golang Engineer  Dublin Ireland, Telnyx , https://ie.indeed.com/jobs?q=web+developer&l=Dublin&start=60&vjk=c9d30699dfbea056
UIUX Designer Dublin, SoftCo , https://ie.indeed.com/jobs?q=web+developer&l=Dublin&start=60&vjk=c729ec7d3195d1f4
SEO Specialist, Staycity Group , https://ie.indeed.com/jobs?q=web+developer&l=Dublin&start=60&vjk=23eab3c178f874f9
MySQL Database Administrator, Shutterstock , https://ie.indeed.com/jobs?q=web+developer&l=Dublin&start=70&vjk=f93d12bf4660cca6
Digital Experience Developer, Lionbridge Technologies , https://ie.indeed.com/jobs?q=web+developer&l=Dublin&start=70&vjk=ee454a404ef9a529
Software Engineer, Houghton Mifflin Harcourt , https://ie.indeed.com/jobs?q=web+developer&l=Dublin&start=70&vjk=b257644be4b29d6e
Software Development Engineer, Amazon Data Srvcs Ireland Ltd , https://ie.indeed.com/jobs?q=web+developer&l=Dublin&start=70&vjk=05ce950df7c13838
Web Developer, VIP Recruitment , https://ie.indeed.com/jobs?q=web+developer&l=Dublin&start=70&vjk=f40367706bb4ad62
Graduate Developer Consultant  Dublin Ireland, Guidewire Software Inc , https://ie.indeed.com/jobs?q=web+developer&l=Dublin&start=70&vjk=2bda8a1991f21d4c
Liferay FrontEnd Developer  Work Remote  35000  450, PFI Knowledge Solutions Ltd , https://ie.indeed.com/jobs?q=web+developer&l=Dublin&start=70&vjk=8fa6cfae6b7317f0
Senior Web UI Developer, Blueface , https://ie.indeed.com/jobs?q=web+developer&l=Dublin&start=70&vjk=fc4ca9c81c3fd3ff
Mobile Developer, Dublin City University , https://ie.indeed.com/jobs?q=web+developer&l=Dublin&start=70&vjk=eb13f68a3e58e171
UX Developer, Sportdec , https://ie.indeed.com/jobs?q=web+developer&l=Dublin&start=70&vjk=fa960e2b4b7dfe84
UX Developer, Sportdec , https://ie.indeed.com/jobs?q=web+developer&l=Dublin&start=80&vjk=fa960e2b4b7dfe84
MidLevel Developers  Learn New Tech, Archer , https://ie.indeed.com/jobs?q=web+developer&l=Dublin&start=80&vjk=845d7c36770b22c8
Technical Customer Service, AWS EMEA SARL Irish Branch , https://ie.indeed.com/jobs?q=web+developer&l=Dublin&start=80&vjk=047479276e25bc24
Full Stack Developer, BlueBridge Technology , https://ie.indeed.com/jobs?q=web+developer&l=Dublin&start=80&vjk=8d49946fd7b35035
Software Development Engineer, Innopharma Technology , https://ie.indeed.com/jobs?q=web+developer&l=Dublin&start=80&vjk=f30ade4f61b257a8
CRM Developer, Ergo , https://ie.indeed.com/jobs?q=web+developer&l=Dublin&start=80&vjk=25544dec3d36793b
Junior UX Full Stack Designer, Hertz Europe , https://ie.indeed.com/jobs?q=web+developer&l=Dublin&start=80&vjk=928dca03eb250d90
Software Development Engineer  Lambda, Amazon Data Srvcs Ireland Ltd , https://ie.indeed.com/jobs?q=web+developer&l=Dublin&start=80&vjk=1d290ef3582fae1c
Demo Engineer Success Graduate, Salesforce , https://ie.indeed.com/jobs?q=web+developer&l=Dublin&start=80&vjk=4b7938675f979088
PHP Developer, Independent News  Media , https://ie.indeed.com/jobs?q=web+developer&l=Dublin&start=80&vjk=d97e8fc329b08b55
Backend  Platform Engineer, Sportdec , https://ie.indeed.com/jobs?q=web+developer&l=Dublin&start=90&vjk=71a0474b7d804023
Microsoft Dynamics CRM  DeveloperAnalyst, DAMCO , https://ie.indeed.com/jobs?q=web+developer&l=Dublin&start=90&vjk=0eb89c70362c6193
Junior Software Engineer DevOps  Kubernetes Dublin Irela, Jet  The Walmart eCommerce Family of Brands , https://ie.indeed.com/jobs?q=web+developer&l=Dublin&start=90&vjk=519b83ff0d7833b9
Junior Software Engineer DevOps Kafka  Dublin Ireland, Jet  The Walmart eCommerce Family of Brands , https://ie.indeed.com/jobs?q=web+developer&l=Dublin&start=90&vjk=f8e01e646352945c
Junior Software Engineer  DevOps  Observability  Dublin, Jet  The Walmart eCommerce Family of Brands , https://ie.indeed.com/jobs?q=web+developer&l=Dublin&start=90&vjk=70fd317385d0ce1d
Python Developer, Blueface , https://ie.indeed.com/jobs?q=web+developer&l=Dublin&start=90&vjk=9883391a7e86ce86
Python Developer, EdgeTier , https://ie.indeed.com/jobs?q=web+developer&l=Dublin&start=90&vjk=5768f30d3baaf0f4
Game Server Engineer, DIGIT Game Studios , https://ie.indeed.com/jobs?q=web+developer&l=Dublin&start=90&vjk=bdb4d3bbcf2d8cbf
Build Engineer, Verizon , https://ie.indeed.com/jobs?q=web+developer&l=Dublin&start=90&vjk=dbf719d7691bb654
MAGENTO FRONTEND DEVELOPER, Monsoon Consulting , https://ie.indeed.com/jobs?q=web+developer&l=Dublin&start=90&vjk=c3da11f0404343ca
