Software Engineer C, Greenfinch Technology , https://ie.indeed.com/jobs?q=.net+developer&l=Dublin&start=0&vjk=9792f643aa91c9f6
C NET Developer, Software Design , https://ie.indeed.com/jobs?q=.net+developer&l=Dublin&start=0&vjk=f3f60ec3c252873a
Net Application Developer  Dublin, Citi , https://ie.indeed.com/jobs?q=.net+developer&l=Dublin&start=0&vjk=67ecc3641726a8c5
Net Developer  Public Sector, Ergo , https://ie.indeed.com/jobs?q=.net+developer&l=Dublin&start=0&vjk=a35d410153c02016
Net Developer, Ergo , https://ie.indeed.com/jobs?q=.net+developer&l=Dublin&start=0&vjk=5b25cd7e14e9421c
NET Developer, Avanade , https://ie.indeed.com/jobs?q=.net+developer&l=Dublin&start=0&vjk=acda954bad565afb
NET Developer C SQL Javascript HTML CSS Multithreadi, Ampers  Consulting , https://ie.indeed.com/jobs?q=.net+developer&l=Dublin&start=0&vjk=931b9a311277d2ce
Full Stack NET Software Developer, Hertz Europe , https://ie.indeed.com/jobs?q=.net+developer&l=Dublin&start=0&vjk=bd8166b2fac932a6
NET Software Developers, Exaxe , https://ie.indeed.com/jobs?q=.net+developer&l=Dublin&start=0&vjk=a20da4612db7d7fc
Software Developer, Eurofins , https://ie.indeed.com/jobs?q=.net+developer&l=Dublin&start=0&vjk=fc6bb567c8279701
NET C Software Developer, Swappsi Software , https://ie.indeed.com/jobs?q=.net+developer&l=Dublin&start=10&vjk=c14632238724af9d
Prime Services Net C Developer, Credit Suisse , https://ie.indeed.com/jobs?q=.net+developer&l=Dublin&start=10&vjk=1af1b116185d6459
Senior Web Developer  C NET, Fidelity Investments , https://ie.indeed.com/jobs?q=.net+developer&l=Dublin&start=10&vjk=aa70105988ee11d5
NET Developer, Granite Digital , https://ie.indeed.com/jobs?q=.net+developer&l=Dublin&start=10&vjk=00ab2a75af6e59c1
Junior NET Software Developer, BearingPoint UK , https://ie.indeed.com/jobs?q=.net+developer&l=Dublin&start=10&vjk=bcc8bc811e930739
Sr NET Developer, Propylon , https://ie.indeed.com/jobs?q=.net+developer&l=Dublin&start=10&vjk=541bcb54b5139584
Sr NET Developer, Propylon Ltd , https://ie.indeed.com/jobs?q=.net+developer&l=Dublin&start=10&vjk=870ca532d90cf7da
NET Developer, ChannelSight , https://ie.indeed.com/jobs?q=.net+developer&l=Dublin&start=10&vjk=d6979a0c1b7279b6
Developer, Fenergo , https://ie.indeed.com/jobs?q=.net+developer&l=Dublin&start=10&vjk=8db6316baf980ef5
Developer Emobility, Wipro LTD , https://ie.indeed.com/jobs?q=.net+developer&l=Dublin&start=10&vjk=ea80f1f59efbb969
UI Developer, Bank of America , https://ie.indeed.com/jobs?q=.net+developer&l=Dublin&start=20&vjk=ac86f33e236a2ed2
Software Developer, Software Design , https://ie.indeed.com/jobs?q=.net+developer&l=Dublin&start=20&vjk=2347a1ee262c68a9
Net Developer, Ryanair , https://ie.indeed.com/jobs?q=.net+developer&l=Dublin&start=20&vjk=b63129be49142a33
Erasmus Web Developer, Stay Planet , https://ie.indeed.com/jobs?q=.net+developer&l=Dublin&start=20&vjk=4d7bb4d043322e4d
Microsoft NET Developer, Version 1 , https://ie.indeed.com/jobs?q=.net+developer&l=Dublin&start=20&vjk=7a64cf03eb853c23
NET Software Engineer, CorrIT Ltd , https://ie.indeed.com/jobs?q=.net+developer&l=Dublin&start=20&vjk=23005d913fbed914
C Net Desktop Developer  Dublin and Madrid Positions, Ryanair , https://ie.indeed.com/jobs?q=.net+developer&l=Dublin&start=20&vjk=7a94ea30cfe7fb61
Net Developer, EUROPEAN DYNAMICS , https://ie.indeed.com/jobs?q=.net+developer&l=Dublin&start=20&vjk=c45cff358a326bfc
Java  C Software Engineers, Greenfinch , https://ie.indeed.com/jobs?q=.net+developer&l=Dublin&start=20&vjk=59afe389af54bdab
Net Developer Dublin, USIT , https://ie.indeed.com/jobs?q=.net+developer&l=Dublin&start=20&vjk=a64f8b8d8af41c27
Java  C Software Engineers, Greenfinch , https://ie.indeed.com/jobs?q=.net+developer&l=Dublin&start=30&vjk=59afe389af54bdab
Net Developer Dublin, USIT , https://ie.indeed.com/jobs?q=.net+developer&l=Dublin&start=30&vjk=a64f8b8d8af41c27
NET Software Developer Intern, Swappsi Software , https://ie.indeed.com/jobs?q=.net+developer&l=Dublin&start=30&vjk=5459a11adfa391f6
Sharepoint Developer, Ergo , https://ie.indeed.com/jobs?q=.net+developer&l=Dublin&start=30&vjk=a93da9f3594ccd9f
Net Developer, Sigmar Recruitment , https://ie.indeed.com/jobs?q=.net+developer&l=Dublin&start=30&vjk=3b37b45f011ba1af
Net Developer  Permanent, Vantage Resources Ltd , https://ie.indeed.com/jobs?q=.net+developer&l=Dublin&start=30&vjk=663be59941a64e73
VBNet Developer  Permanent, Vantage Resources Ltd , https://ie.indeed.com/jobs?q=.net+developer&l=Dublin&start=30&vjk=832b634ef48300b1
CRM Developer, Ergo , https://ie.indeed.com/jobs?q=.net+developer&l=Dublin&start=30&vjk=2b5a21aac3c904ce
Software Developer, eDuce Software , https://ie.indeed.com/jobs?q=.net+developer&l=Dublin&start=30&vjk=624c53406747234b
CNet Developer, Eden Recruitment , https://ie.indeed.com/jobs?q=.net+developer&l=Dublin&start=30&vjk=77cc5ece9b69b307
NET Backend Developer, Oneview Healthcare , https://ie.indeed.com/jobs?q=.net+developer&l=Dublin&start=40&vjk=58bfa445c44b8463
Net Developer  Permanent, Vantage Resources Ltd , https://ie.indeed.com/jobs?q=.net+developer&l=Dublin&start=40&vjk=663be59941a64e73
Junior Email Marketing CoOrdinator, Web Summit , https://ie.indeed.com/jobs?q=.net+developer&l=Dublin&start=40&vjk=3cc5b8d7e7139a8b
Net Developer, Sigmar Recruitment , https://ie.indeed.com/jobs?q=.net+developer&l=Dublin&start=40&vjk=2ff68f413f93c7b3
VBNet Developer  Permanent, Vantage Resources Ltd , https://ie.indeed.com/jobs?q=.net+developer&l=Dublin&start=40&vjk=832b634ef48300b1
Software Engineer Net, Verizon , https://ie.indeed.com/jobs?q=.net+developer&l=Dublin&start=40&vjk=bd14fdd39065e90d
CNet Developer, Eden Recruitment , https://ie.indeed.com/jobs?q=.net+developer&l=Dublin&start=40&vjk=77cc5ece9b69b307
Build Engineer, Verizon , https://ie.indeed.com/jobs?q=.net+developer&l=Dublin&start=40&vjk=dbf719d7691bb654
Full Stack Engineer, Datahug , https://ie.indeed.com/jobs?q=.net+developer&l=Dublin&start=40&vjk=877a8f4757129ab8
Senior Software Developer, GameStop Limited , https://ie.indeed.com/jobs?q=.net+developer&l=Dublin&start=40&vjk=51f116a3bf5c8fae
Full Stack Net Developer, Experis UK  Ireland , https://ie.indeed.com/jobs?q=.net+developer&l=Dublin&start=50&vjk=4dddc6aee4364b7d
Hot Job VBNet Developer  Contract, Vantage Resources Ltd , https://ie.indeed.com/jobs?q=.net+developer&l=Dublin&start=50&vjk=bc12bc5f86cb3e01
Software Engineer Net, Verizon , https://ie.indeed.com/jobs?q=.net+developer&l=Dublin&start=50&vjk=bd14fdd39065e90d
Senior Software Developer, GameStop Limited , https://ie.indeed.com/jobs?q=.net+developer&l=Dublin&start=50&vjk=51f116a3bf5c8fae
Build Engineer, Verizon , https://ie.indeed.com/jobs?q=.net+developer&l=Dublin&start=50&vjk=dbf719d7691bb654
Full Stack Engineer, Datahug , https://ie.indeed.com/jobs?q=.net+developer&l=Dublin&start=50&vjk=877a8f4757129ab8
Senior NET Developer, Flipdish , https://ie.indeed.com/jobs?q=.net+developer&l=Dublin&start=50&vjk=98003718a20c798f
Microsoft Dynamics CRM  DeveloperAnalyst, DAMCO , https://ie.indeed.com/jobs?q=.net+developer&l=Dublin&start=50&vjk=0eb89c70362c6193
Microsoft SQL Development  Support, IPSUS , https://ie.indeed.com/jobs?q=.net+developer&l=Dublin&start=50&vjk=ac4895c62ec9475e
Full stack engineer, Fluke , https://ie.indeed.com/jobs?q=.net+developer&l=Dublin&start=50&vjk=50e10f7a378b06ba
Software Developer, Dovetail Human Resource Solutions , https://ie.indeed.com/jobs?q=.net+developer&l=Dublin&start=60&vjk=b3408336eac599ce
Process Automation Developer, UnitedHealth Group , https://ie.indeed.com/jobs?q=.net+developer&l=Dublin&start=60&vjk=488b8477d47a8949
Net Developer  Angular, Sigmar Recruitment , https://ie.indeed.com/jobs?q=.net+developer&l=Dublin&start=60&vjk=b276206bafd63ed9
NET Developer, GemPool , https://ie.indeed.com/jobs?q=.net+developer&l=Dublin&start=60&vjk=f2817fe0e6bdc116
Senior Net Developer, Ryanair , https://ie.indeed.com/jobs?q=.net+developer&l=Dublin&start=60&vjk=c6c3af9f82109367
Penetration Tester, Micro Focus , https://ie.indeed.com/jobs?q=.net+developer&l=Dublin&start=60&vjk=5625d099e8c1cc67
Full Stack Net Developer, Experis UK  Ireland , https://ie.indeed.com/jobs?q=.net+developer&l=Dublin&start=60&vjk=4dddc6aee4364b7d
Hot Job Net Developer  Contract, Vantage Resources Ltd , https://ie.indeed.com/jobs?q=.net+developer&l=Dublin&start=60&vjk=4b77498738affaf2
Technical Lead, Eurofins Ireland IT Solutions , https://ie.indeed.com/jobs?q=.net+developer&l=Dublin&start=60&vjk=5b4197a0cb4bd25a
Hot Job VBNet Developer  Contract, Vantage Resources Ltd , https://ie.indeed.com/jobs?q=.net+developer&l=Dublin&start=60&vjk=bc12bc5f86cb3e01
SENIOR NET DEVELOPER, Progress Systems , https://ie.indeed.com/jobs?q=.net+developer&l=Dublin&start=70&vjk=c81feda6c7bda8a5
Mobile Architect, Verizon , https://ie.indeed.com/jobs?q=.net+developer&l=Dublin&start=70&vjk=080927d77124641d
Application Support Net C, Enterprise Registry Solutions , https://ie.indeed.com/jobs?q=.net+developer&l=Dublin&start=70&vjk=65f4d7fedb66ae66
Software Developer, Dovetail Human Resource Solutions , https://ie.indeed.com/jobs?q=.net+developer&l=Dublin&start=70&vjk=b3408336eac599ce
NET Developer, GemPool , https://ie.indeed.com/jobs?q=.net+developer&l=Dublin&start=70&vjk=f2817fe0e6bdc116
Senior Net Web Developer, Verizon , https://ie.indeed.com/jobs?q=.net+developer&l=Dublin&start=70&vjk=0688565c49e44880
Technical Analyst  Docker, NTT DATA Services , https://ie.indeed.com/jobs?q=.net+developer&l=Dublin&start=70&vjk=b46326267012c31b
Software Engineer  Cloud ES, Microsoft , https://ie.indeed.com/jobs?q=.net+developer&l=Dublin&start=70&vjk=6d4e05f7e584159d
Software Engineer  NET, LetsGetChecked , https://ie.indeed.com/jobs?q=.net+developer&l=Dublin&start=70&vjk=4efa5bfe2db7cb57
NET Contractor, GemPool , https://ie.indeed.com/jobs?q=.net+developer&l=Dublin&start=70&vjk=9d48bfdf1f717809
Software Developer, Morgan McKinley , https://ie.indeed.com/jobs?q=.net+developer&l=Dublin&start=80&vjk=61ead71e7f1d785d
Net FullStack Developer in Dublin city centre, Harvey Nash Ireland , https://ie.indeed.com/jobs?q=.net+developer&l=Dublin&start=80&vjk=80eed4c1a1fed990
Ruby Engineer  Product, Web Summit , https://ie.indeed.com/jobs?q=.net+developer&l=Dublin&start=80&vjk=83c5e07e9a42786d
MicroServices NET Core Developer, Archer , https://ie.indeed.com/jobs?q=.net+developer&l=Dublin&start=80&vjk=c8668767d38f2cf9
MidLevel Developers  Learn New Tech, Archer , https://ie.indeed.com/jobs?q=.net+developer&l=Dublin&start=80&vjk=845d7c36770b22c8
MidLevel C Net Software Developer, Reperio Human Capital , https://ie.indeed.com/jobs?q=.net+developer&l=Dublin&start=80&vjk=26169295b56ac52d
C Net Software Developer  Dublin CC, Reperio Human Capital , https://ie.indeed.com/jobs?q=.net+developer&l=Dublin&start=80&vjk=8d308339fa47ff42
VBNet Developer  Contract, Vantage Resources , https://ie.indeed.com/jobs?q=.net+developer&l=Dublin&start=80&vjk=10c0c00162d30ade
Web Developer  ASPNET  Creative and Fun Environment, Recruiters , https://ie.indeed.com/jobs?q=.net+developer&l=Dublin&start=80&vjk=18c932fd0af4d0ce
C NET Development Contract,  , https://ie.indeed.com/jobs?q=.net+developer&l=Dublin&start=80&vjk=af985d09fddf2e7d
Cloud Support Engineer Developer and Mobile Services  AWS, AWS EMEA SARL Irish Branch , https://ie.indeed.com/jobs?q=.net+developer&l=Dublin&start=90&vjk=51bfe4c8406aac0b
Microsoft Dynamics NAV  Dynamics 365 Business Central Devel, Datapac , https://ie.indeed.com/jobs?q=.net+developer&l=Dublin&start=90&vjk=adcd895aed3ba116
Net Developer in Dublin City Centre, Harvey Nash Ireland , https://ie.indeed.com/jobs?q=.net+developer&l=Dublin&start=90&vjk=1ddae5d1acf7adaf
Technical Lead, Eurofins , https://ie.indeed.com/jobs?q=.net+developer&l=Dublin&start=90&vjk=cfb49717e5152f57
ASPNet Full Stack Developer, Trent Recruitment , https://ie.indeed.com/jobs?q=.net+developer&l=Dublin&start=90&vjk=3b3907a8b769ac2b
Xamarin Developer  South Dublin, IT Search , https://ie.indeed.com/jobs?q=.net+developer&l=Dublin&start=90&vjk=8ba444d052a05429
Systems Software Developer, Morgan McKinley , https://ie.indeed.com/jobs?q=.net+developer&l=Dublin&start=90&vjk=f12f90ebbb133dac
NET Developers  Fast Growing Tech  North Dublin, Oliver James Associates , https://ie.indeed.com/jobs?q=.net+developer&l=Dublin&start=90&vjk=ee14b666542d85c9
C Net Software Developer  Dublin, Reperio Human Capital , https://ie.indeed.com/jobs?q=.net+developer&l=Dublin&start=90&vjk=afb756065c7f72a4
ReactJS Developer  South Dublin, Oliver James Associates , https://ie.indeed.com/jobs?q=.net+developer&l=Dublin&start=90&vjk=0a660a7b69453088
